,img_src,title,link,id,developer_link,developer_name,description,price_inapp,category,num_downloads,num_downloads_approx,published,published_timestamp,pegi,filesize,os,software,price,rating
9,https://lh3.googleusercontent.com/2uArwgK7Tdb0zWZQI0xKrQQNbTexlE7RndVEhOS2M07Ry6RGIRGxypsIyw8QXTfk5Q,Castle Defense 2,https://play.google.com/store/apps/details?id=com.droidhang.cd2&hl=nl&gl=nl,com.droidhang.cd2,https://play.google.com/store/apps/developer?id=DH+Games,DH Games,"A new era of war has arrived. The sequel to the original tower defense game with over 10,000,000 players worldwide: Castle Defense 2. <br><br>Summary<br>Years ago, the kingdoms of man were put to the test in a war that lasted decades. Only with the aid of powerful heroes, ancient magic, and the cunning strategy of great leaders, was mankind able to defend itself and repel the orcish onslaught.Peace ensued, but not forever. Scouts reports that demon power is rising at the edge of our Kingdom. The orcs have seized vast wilderness that was once our hunting grounds. Somewhere in the wilderness,the evil ones have opened a portal to the nether-realm, and are amassing armies of unspeakable horrors.<br><br>Great heroes, wherever you are. Your empress has summoned you! Now is the time to defend our realm before it&#39;s lost to bloodthirsty demons forever. Join us in our war against evil. <br><br>A new era of war has arrived.  Tower defense masterpiece--Castle Defense 2--is sweeping the tower defense world. By combining traditional tower defense game play with RPG elements and all new Battle Pets, Castle Defense 2 has created a fusion of strategies and a whole new kind of tower defense experience. <br><br>Resist waves of enemies by combining strategic placement of defense towers as well as utilizing the skills of powerful heroes. Noble knights, magic wizards, dragon riders and more are all at your command.  <br><br>Game Features<br>【NEW TYPES OF TOWERS】<br>★ Floating Fortress, Super Fort, Steam Plant, Alchemist&#39;s Laboratory, and more magical towers!<br>【HEROES】<br>★ Berserker from the Volcano, A Mysterious Female Assassin, The Mage of the Woods. Each with unique equipment and particular skills. You command the heroes to help defend where towers aren&#39;t enough. <br>【ABILITIES】<br>★ Upgrade talents along the path you choose, adding a unique blend of RPG strategy to the game. <br>【BATTLE PETS】<br>★ Fight alongside your heroes in the long war ahead, your magical Battle Pets can be the difference between victory or defeat!<br>【DIABOLICAL BOSSES】<br>★ Giant and Horrific Golem, The Evil Warlock who can rip the fabric of space-time,The Wurm with an ancient hunger, and spritely hidden goblins!<br>【TO BATTLE】<br>★ Choose wisely, place your towers strategically or be overrun the enemy!<br><br>[Campaign Mode] : Fight your way page by page through your own story<br>[Endless Mod] : Face wave after wave of monsters. Defeat is inevitable, but how long can you last?<br>[Expedition Mode] : 15 new stages, each different than before with new .unexpected challenges!<br>[Boss Rush] : join players across the world to defeat the World Boss! Participate in the world&#39;s largest online battle! <br>[PVP Arena] : Pit your forces against another player in PVP mode. Battle for glory and honor (and honor points!) <br><br>Comprehensive beginners guide makes you a capable leader in no time.<br>★TIP: This game is hella fun! <br>★Don&#39;t need to be online to play!<br><br>Any questions, please feel free to contact us:<br>Facebook:  https://www.facebook.com/CastleDefense2<br>Email:   castledefense2@gmail.com","€ 2,17 - € 32,59 per item",GAME_STRATEGY,2806922,1000000,Fri Jan 20 05:42:55 2017,1484878375,PEGI 7,34M,2.3.3 en hoger,3.2.2,0 USD,3.8875473
10,https://lh3.googleusercontent.com/2MNn3aBsoxtUpvj126CNtshhbRw0ROZh7QO664mwRUcAX8gFFtr-KLTO98pDQFuUVNDt,Kingdom Rush Frontiers - Tower Defense Game,https://play.google.com/store/apps/details?id=com.ironhidegames.android.kingdomrushfrontiers&hl=nl&gl=nl,com.ironhidegames.android.kingdomrushfrontiers,https://play.google.com/store/apps/dev?id=9170275381782328383,Ironhide Games,"Kingdom Rush Frontiers is a whole new level of the furiously fast, enchantingly charming gameplay that made kingdom Rush an award-winning Tower Defense hit. <br>Defend exotic lands from dragons, man-eating plants, and ghastly denizens of the underworld -all with flashy towers, levels, heroes, and more goodies to help you crush your enemies to a pulp.<br> <br><h1><b>BUILD MIGHTY TOWERS!</b></h1><br><br><b>• OVER 18 TOWER ABILITIES!</b> Unleash Death Riders, pestilence clouds, or assassins that steal and kill your enemies! <br><br><b>• 8 SPECIALIZED TOWER UPGRADES!</b> Slice, sizzle, and stomp your foes with Crossbow Forts, Mighty Templars, Necromancers, and even Earthquake Machines - hey, we told you we were shaking things up. <br><br><b>• UPGRADE SYSTEM</b> allows you to min/max your towers towards your preferred strategy. <br><br><b>• Fortify the frontier in exotic news lands - hold the line in deserts, jungles, and even the underworld! <br> <br><h1><b>TRAIN LEGENDARY HEROES</b></h1><br><br><b>• 16 LEGENDARY HEROES.</b> Choose among mighty champions and train their abilities! Each has unique specialties that fit different play styles and strategies!<br><br><b>• Special units and features on every stage! Watch out for the Black Dragon! <br> <br><h1><b>DEFEAT THEM ALL</b></h1><br><br><b>• OVER 40 ENEMIES</b> with unique abilities! Stay on your toes as you fight through desert sandworms, tribal shamans, nomad tribes, and underground terrors. Action like you have never seen before!<br><br><b>• MERCILESS BOSS FIGHTS!</b> Hey, we told you to get those upgrades...<br> <br><h1><b>MORE MIND-BOGGLING CONTENT</b></h1><br><br><b>• Hours of army with OVER 80 ACHIEVEMENTS!</b> what can you expect from Ironhide Games, the creators of Kingdom rush? You will be hooked for hours searching for Easter eggs and achievements!<br> <br><b>• IN-GAME ENCYCLOPEDIA!</b> learn all about your enemies and you will be able to plan the best strategy to defeat them. Study up!  <br><br><b>• CLASSIC, IRON, AND HEROIC GAME MODES</b> to challenge your tactical skills! <br><br><b>• 3 DIFFICULTY MODES!</b> Are you up for a real challenge? Go with Hard mode! <br><br><b>• PLAY IT OFFLINE!</b> No internet? No problem! You will be able to jump into real action even offline! <br> <br>-----------------------------------------------------<br><br>PRAISE FOR KINGDOM RUSH:</b> IGN Editor&#39;s Choice, Slide To Play Must Have, 148 Apps Editor&#39;s Choice, Jay is Games Game of the Year, Pocket Gamer Gold Award, Touch Arcade 4.5/5<br><br>Terms and Conditions:<br>https://www.ironhidegames.com/TermsOfService<br><br>Privacy Policy:<br>https://www.ironhidegames.com/PrivacyPolicy<br><br><b>Video creators, podcast creators, and streamers:</b><br>We would love to see your content on Youtube and Twitch! We support and promote channel creators so, if you want us to showcase your videos or want to know more about our games, feel free to write to us to contact@ironhidegames.com</b>","€ 0,99 - € 49,99 per item",GAME_STRATEGY,1432738,1000000,Thu Jul  2 23:28:00 2020,1593716280,PEGI 7,Varieert per apparaat,Varieert per apparaat,4.2.25,1990000 EUR,4.7559404
11,https://lh3.googleusercontent.com/a5qp0Q_HuFqkFAoOX5FkhBps9dH4MHcRgEXcN-sW_UPry8sK5JqbUQbebMJqr9x5Ajpt,Summoner's Greed: Endless Idle TD Heroes,https://play.google.com/store/apps/details?id=com.pixio.google.mtd&hl=nl&gl=nl,com.pixio.google.mtd,https://play.google.com/store/apps/dev?id=9097044332653942940,PIXIO,"You, the greatest and most powerful summoner, broke into the King’s castle and stole his priceless royal treasure! You gleefully take your loot back to your lair… But! The King has sounded the alarm and deployed his endless army of valiant heroes to bring it back! Grrr... It’s time to ready your defenses! They can’t steal your Precious… <br><br><br>In this idle TD game, you will strategically place your towers and cast powerful spells to defend against endless waves of the Kingdom’s mightiest heroes. Defend your ‘stolen’ (pshhh) loot against a variety of do-gooding heroes like the lowly peasant, the axe-wielding lumberjack, the ice mage and the King’s Elite Knight himself - you kinda don’t want to mess with <i>him</i>! <br><br><br><b>SUMMON MONSTERS &amp; MINIONS TO FIGHT THE KING’S ARMY!</b><br>Earn magical orbs for defeating wave after wave of the King’s heroic army - use them to power your summoner’s portal to call forth a variety of monsters, creeps and minions to aid your defense! Recruit the common slimes, Slimey and Grimey - the super rare and absurdly cute hellhound Mocha - or Teddy, the EPIC teddy bear with superhuman strength! With dozens of creatures to call to your defense, do you have what it takes to defend against the heroes of the Kingdom? <br><br><br><b>CAST POWERFUL SPELLS. OBLITERATE THOSE WHO DARE TO ATTACK YOU</b><br>So… Is the King stupid or something? He seems to have forgotten that you can shoot fireballs from your hands! Hello? Torpedoes of FIRE? In addition to your misfit army of monsters, you can cast powerful spells to bring death from above to your enemies. Use fireballs, lightning, ice and more to power up your monsters, rebuild defenses or defend your lair against the King’s army. Radical! <br><br>----------------------------------------------------------<br><b>SUMMONER’S GREED – HIGHLIGHTS</b><br>----------------------------------------------------------<br>• Dozens of monsters and towers to summon<br>• Defend against endless waves of heroes and bosses<br>• Each monster has their own unique abilities and secondary powers<br>• Upgrade your towers to increase their effectiveness<br>• Collect common, rare, epic and legendary monsters<br>• Defeat a variety of enemy heroes, each with their own unique skills<br>• Strategically place your towers to cause maximum damage<br>• Use &amp; upgrade spells to destroy, rebuild defences and buff your minions<br>• Original graphics &amp; unique gameplay for a totally new kind of TD experience<br><br><b>SUMMON. DEFEND. DESTROY. DOWNLOAD SUMMONER’S GREED TODAY!</b><br><br><br>Support<br>Are you having problems? Email us at Support@pixio.co or contact us in game by going to Settings&gt; Email Us<br><br>Privacy Policy:<br>http://www.pixio.co/file/PixioPrivacyPolicy.pdf<br><br>Facebook: https://www.facebook.com/summonersgreed/<br>Instagram: https://www.instagram.com/summoners.greed/","€ 0,99 - € 99,99 per item",GAME_STRATEGY,2620832,1000000,Tue Aug 25 16:18:47 2020,1598356127,PEGI 7,77M,4.1 en hoger,1.19.0,0 USD,4.6495843
12,https://lh3.googleusercontent.com/bGohU6t5x1ITIoe2GXykXThWcRC1ucwJbMilNP01QTazdjWqGt5vdK5nPRA_SG2csGI,Braveland Heroes,https://play.google.com/store/apps/details?id=com.tortugateam.bravelandheroes&hl=nl&gl=nl,com.tortugateam.bravelandheroes,https://play.google.com/store/apps/dev?id=8266018840834401489,Tortuga Team,"Old-school mobile turn-based RPG strategy!<br><br>The king&#39;s scepter of the Seven Kingdoms was perfidiously stolen from the throne room. The kings have summoned the mightiest heroes of magic and offered a generous bounty to the person, who returns it. In high spirits, you set off on a dangerous quest in the search of the royal relic. Use tactics to lead legions of heroes, fight the bosses and conquer other players! As you play, your army will be joined by various kinds of allies – archers, monks, demons, beasts, knights, and many others. Your journey begins in an ancient forest; you will pass through the southern lands and over the high mountains, you will encounter orcs, ghosts and mysterious nomads. In the north you will fight with might and main in the age of Vikings wars, rush into the clash of thieves and assassins, and try to bear the palm in fights of fiends and pirates.<br><br>Key game features:<br>✔ Free PvE and PvP game modes<br>✔ Hand drawn HD game world<br>✔ Right from the start, you may choose between 3 heroes: a Barbarian, a Pirate, and a Sorceress.<br>✔ Creating and upgrading weapons and ammunition<br>✔ A full range of unique battles with unexpected twists<br>✔ An evolving Heroes Saga – lead more mighty Heroes into battle, than ever before!<br>✔ Dungeons with random-generated battles and worthy rewards<br>✔ An abundance of powerful artifacts <br>✔ Each hero adheres to a unique academy of pure battle magic which completely changes the course of the battle<br>✔ And, of course, the party’s headliners – the insidious bosses<br><br>Join the adventures in Braveland, online game played by thousands of people every day! Create and level up your hero! Immerse yourself in a world of fierce real-time battles against other players. Enjoy vivid combat graphics and enchanting music. Use your magic skills to gain your edge in the world of Braveland Battles!<br><br>Game community<br>Join our community and follow the latest updates<br>Facebook group - www.facebook.com/bravelandheroes<br>Our Twitter - twitter.com/BravelandHeroes<br>Support Team - support@playbraveland.com <br><br>Notes:<br>1. Braveland Heroes game is completely free; however, to make the game process more interesting for yourself, you can purchase different items.<br>2. Fighting Duels on the Arena  requires an internet connection. You can also go on a PvE adventure in the offline mode, if that is more convenient for you!<br>3. For a stable game play, Android 4.0 or higher is required.<br><br>Welcome to Magic Heroes! Install the game right now for free!","€ 0,59 - € 99,99 per item",GAME_STRATEGY,875603,500000,Tue Jul 21 11:56:15 2020,1595316375,PEGI 7,Varieert per apparaat,4.1 en hoger,1.51.7,0 USD,4.58099
13,https://lh3.googleusercontent.com/Cdo9RXxx_GBI0FkTLGH2Q3cD1tEylHqlidnXor7afFxsgWJxfW-xcmb3bg6gRHlTaxKS,Kingdom Wars,https://play.google.com/store/apps/details?id=com.spcomes.stormdefense&hl=nl&gl=nl,com.spcomes.stormdefense,https://play.google.com/store/apps/dev?id=4931745640662708567,Springcomes,Makkelijk te spelen! Gericht op Level up en Strategie!<br>Win de oorlog tegen het kwade leger! Red het Koninkrijk!<br>Verschillende personages en fasen!<br><br>Voorzien zijn van:<br>- Meer dan 400 verschillende stadia<br>- Meer dan 200 unieke bondgenoten en vijandelijke eenheden<br>- Meer dan 100 bondgenoten hebben hun unieke Limit-break-looks<br>- Verzamel schatten in elke fase en activeer verschillende optie-effecten<br>- Speel anders en strategisch met 6 soorten boosteritems<br><br><br>Homepage:<br>https://play.google.com/store/apps/dev?id=4931745640662708567,"€ 0,79 - € 269,99 per item",GAME_STRATEGY,18953985,10000000,Tue Sep 29 07:34:00 2020,1601352240,PEGI 3,43M,4.1 en hoger,1.6.5.2,0 USD,4.3101964
14,https://lh3.googleusercontent.com/iniwxOTrpsMwoVr1kmbrrxEE9X8UKQg3YkAobMdAi0CXq0frj0WigD2na9CeaXbaksM,Kasteel Verdediging Koning,https://play.google.com/store/apps/details?id=com.mobirix.casdefs&hl=nl&gl=nl,com.mobirix.casdefs,https://play.google.com/store/apps/dev?id=4864673505117639552,mobirix,"Bereid eindeloze vijandelijke golven voor door kastelen, helden en soldaten te versterken!<br><br>[Versterkingstips]<br>- Bereid je verdedigingsbasis voor door eerst muren en soldaten te versterken<br>- Probeer unieke helden te combineren<br>- Versterk ten slotte je toren en magie om de veroveringsoorlog uit te dagen<br>- Als hoger torenniveau, sterker de magie.<br>- Er is een held die de vaardigheid elke keer gebruikt met magie.<br><br>[Strategietips]<br>Het is gemakkelijker om te verdedigen met behulp van 3 soorten spreuken<br>Herstel magie: de gezondheid van de muur herstellen<br>Magische bom: magische bommen laten vallen om vijanden aan te vallen<br>IJsstorm: monsters vertragen die in sneeuwstorm breken<br><br>- Massale vijandelijke golf<br>- Eenvoudige en eenvoudige strategiedefensie<br>- Leuke helden en verschillende monsters<br>- Overwin oorlogsuitdaging tot het uiterste<br>- Neem het op tegen de spelers in de wereld met vijandelijke golven vrij<br>- Gratis om te spelen<br>- Ondersteund offline spel zonder wifi<br>- Ondersteunde Low spec-apparaten<br>- Ondersteunde tablet-apparaten<br>- Ondersteunde prestaties en leaderboard<br><br><br>Homepage :<br>https://play.google.com/store/apps/dev?id=4864673505117639552<br><br>Facebook : <br>https://www.facebook.com/mobirixplayen<br><br>YouTube :<br>https://www.youtube.com/user/mobirix1","€ 2,99 - € 99,99 per item",GAME_STRATEGY,234419,100000,Tue Sep 29 03:02:59 2020,1601335979,PEGI 3,39M,4.1 en hoger,1.0.4,0 USD,4.082988
15,https://lh3.googleusercontent.com/jbAP1Mu8vEiKM-INfhTd-NE6cKnh9sIPPSe0cvyY5NgDUk2QrfuN2ARL7VDtdaZmZ1A,Royal Defense King,https://play.google.com/store/apps/details?id=com.mobirix.defenseking&hl=nl&gl=nl,com.mobirix.defenseking,https://play.google.com/store/apps/dev?id=4864673505117639552,mobirix,"Roep helden en soldaten en verdedig het binnenvallende leger van Undead.<br><br>[Kenmerken]<br>- Strategiegame met eenvoudige bediening van Summon, Skill en Energy Recharge<br>- Zelfactiverende unieke vaardigheid voor elk personage<br>- Gebiedsvaardigheid die maximaal effect kan hebben als u het goed doet<br>- Nieuwe personages ontgrendeld door uitdagingen in Stadia en Eindeloze Modus op te heffen<br>- Bonuseffect wanneer een personage Lv bereikt. 10<br><br>Homepage:<br>https://play.google.com/store/apps/dev?id=4864673505117639552<br><br>Facebook: <br>https://www.facebook.com/mobirixplayen<br><br>YouTube :<br>https://www.youtube.com/user/mobirix1","€ 1,99 - € 99,99 per item",GAME_STRATEGY,1405035,1000000,Wed Jan 29 13:50:40 2020,1580293240,PEGI 7,38M,4.1 en hoger,1.4.8,0 USD,4.2148824
16,https://lh3.googleusercontent.com/27WsajD7fZttE3v-syv2RGg1vaRgK93qy85h9FR3cPOCXs3LVJRkA8yzfQdSMFbisQ,Tower Conquest,https://play.google.com/store/apps/details?id=com.sgiggle.towerconquest&hl=nl&gl=nl,com.sgiggle.towerconquest,https://play.google.com/store/apps/developer?id=Titan+Mobile+LLC,Titan Mobile LLC,"Venture into the world of Tower Conquest in your search for eternal glory!  Recruit and evolve the perfect army to destroy opposing towers.  Explore endless worlds and defeat enemies to earn treasure, increase your strength, and dominate the Player Leagues!<br><br>Game Features:<br>● Five separate factions comprised of 70 unique characters, heroes and towers.<br>● Objective based strategic combat that challenges your skills in defense and speed!<br>● Vibrant 2D art style, with custom animation and over 50 faction specific backgrounds.<br>● Collect cards to unlock and evolve your units, allowing them to gain powerful and unique abilities!<br>● A generative map system with ever-growing rewards as you meet objectives and travel to new worlds!<br>● Robust daily Quest and Merchant offerings.<br>● With 5 unique squad slots, mix and match 1,000’s of character combinations to find your perfect team!<br>● Share gifts with Facebook friends and battle in challenging Player vs. Player combat.<br><br>-------------------<br><br>No connection?  No problem!  <br>You can play Tower Conquest Online or Offline.","€ 1,09 - € 219,99 per item",GAME_STRATEGY,8032221,5000000,Fri May 22 09:31:38 2020,1590123698,PEGI 7,107M,4.1 en hoger,22.00.51g,0 USD,4.3711605
17,https://lh3.googleusercontent.com/g9uppTVnXxLSlVV0tKz1FjAd3NOMlXiWoT8i-44sILCX5_0lCewF67WfYvYZ93dH5k3s,Castle Creeps TD - Epic tower defense,https://play.google.com/store/apps/details?id=com.outplayentertainment.castlecreepstd&hl=nl&gl=nl,com.outplayentertainment.castlecreepstd,https://play.google.com/store/apps/dev?id=5587345788514684720,Outplay Entertainment Ltd,"Bring out your everyday Hero and lead troops to victory in the best fantasy mobile Tower Defense game! Fortify your defense and prepare to brawl ferocious Warlords, colossal Ogres &amp; savage Goblins! Change strategy on the fly in this challenging, non-stop brawl experience! <br><br>From the makers of Alien Creeps, face countless challenging tower defense battles &amp; taste hard earned victory as you build, upgrade and repair horde-splatting Towers. Recruit and level up mighty Heroes to protect the kingdoms in this top Tower Defense experience!<br><br>Invite friends through Facebook and share magical powers to aid you in battle and defend the realm!<br><br>- Free and easy to play tower defense strategy game! Download now!<br>- Heroes are free to deploy at will! Unlock them all!<br>- Face dangerous Warlords with your most powerful Heroes in this unique mode of play!<br>- Switch up your strategy – command and inspire your team of Heroes to outwit the horde!<br>- Ultimate Tower control – build, upgrade, sell and repair on the fly!<br>- Battle against creeps in fast-paced battles and epic chapters!<br>- Updated regularly with new chapters, enemies and epic Heroes!<br><br>Why wait for brawl stars, download Castle Creeps today and bring out your everyday hero! <br><br><br>Find our latest news here:<br>Facebook/CastleCreepsTD<br>@CastleCreepsTD<br><br>Castle Creeps TD is free to download and play, but contains optional in-app purchases that cost real money.<br><br>© 2017 - 2019 Outplay Entertainment Ltd. Castle Creeps TD is a trademark of Outplay Entertainment Ltd. All rights reserved. 塔防","€ 1,09 - € 114,99 per item",GAME_STRATEGY,3651210,1000000,Wed Aug  5 15:29:46 2020,1596625186,PEGI 7,97M,4.1 en hoger,1.50.1,0 USD,4.410234
