,img_src,title,link,id,developer_link,developer_name,description,price_inapp,category,num_downloads,num_downloads_approx,published,published_timestamp,pegi,filesize,os,software,price,rating
0,https://lh3.googleusercontent.com/0wCGol0LqPfvVS9CowlyK8SJToC4d3cmkLYw9bTmBCwFq-pUXri-jn_nKx5XmE35a5o,Realm Defense: Epic Tower Defense Strategy Game,https://play.google.com/store/apps/details?id=com.babeltimeus.legendstd&hl=nl&gl=nl,com.babeltimeus.legendstd,https://play.google.com/store/apps/developer?id=Babeltime+US,Babeltime US,"Calling all strategic tower defenders! Are you a fan of epic online tower defense games? Become a hero of war in and download now to join heroes like Smoulder the Dragon, ninjas, wizards, and many other defenders of the realm in their ongoing quest to defend the realm! <br><br>Start playing Realm Defense - TD strategy game now and fight in the battle of heroes against monsters. <br>Use your archery skills as you build a barracks, magic towers and more, in the #1 castle defender!<br><br><b>It will take a hero’s tactic to save the turrets and towers from invasion. Do you have what it takes to engage in realm defense? </b><br>This real-time kingdom rush castle defense game needs your help to battle and conquer! We need your skills to defend the tower – The Allied Kingdoms have one choice in this TD game: defend, defend, defend! Battle with Death Knights and fight alongside dragons, wizards, ice queens, knights and other ancient gods in our magical fantasy adventure field! You can acquire gems, potions, elixir, and even spells while working your way up to become a champion and hero! Are you ready to save the kingdom and be the best realm grinder out there? Smoulder needs your help against the Goblin King! Defend the realm - be a castle defender and show us your TD skills in this online strategy game. We’re counting on your castle defense skills to help in our kingdom rush frontier! <br> <br><br><b>Realm Defense is an ultimate tower kingdom defense game that challenges skilled players like you! </b><br>Use our huge variety of powers and abilities to overcome obstacles in over 300 levels. By being a part of our kingdom rush frontier, you will travel through lush forests, snow covered mountains, and epic deserts as you use YOUR strategy to face off against enemies! The opportunities are endless – YOU will oversee the building a heroic team, discovering secret challenges, and upgrading your towers! <br>Deploy rapid-fire archers! Carve walls on the map with magic beams! Fire roaring cannons! Summon allies! Realm Defense offers variety and challenge. Overcome incredible odds with strategy and wit! Rescue helpless villagers, collect important resources, and recruit legendary heroes with deadly abilities along the way to stop evil in this standout tower defense game.  <br><br>•	300+ levels with various game play modes<br>•	Multiple worlds and realms to play with – Each having four different towers <br>•	Compete in tournaments to display your tower defense skills and win big prizes<br>•	Powerful heroes with unique abilities to aid you: Fee the Archer launches a deadly Kill Shot, Lancelot the Knight unleashes the Fist of Justice, Smoulder the Dragon rains down Heat Seeker fireballs and many more<br>•	Face off against epic bosses including a Skeleton Mage that rides a giant slime and zaps your heroes and a bomb tossing, mammoth riding Goblin King, and smolder your enemies to victory<br>•	Huge variety of enemies offer multiple challenges: Burn your enemy, freeze them, and more with 4 spells to cast in battle<br>•	Beautiful landscapes and character animations<br>•	One of the best tower defense games free on the android market<br>•	Fun strategy games and royal challenges<br><br>PLEASE NOTE! This online TD game is free to play and made by people who love tower defense games. We sincerely hope you enjoy our work!<br><br>Facebook: https://business.facebook.com/RealmTowerDefense<br><br>* Allows applications to access information about networks. (ACCESS_NETWORK_STATE)<br>* Allows applications to access information about Wi-Fi networks. (ACCESS_WIFI_STATE)<br>* Allows applications to open network sockets. (INTERNET)<br>* Allows access to the vibrator. (VIBRATE)<br>* Allows Google Play billing service. (BILLING)<br>* Allows Play Install Referrer API. (BIND_GET_INSTALL_REFERRER_SERVICE)","€ 0,99 - € 104,99 per item",GAME_STRATEGY,7346106,5000000,Thu Jul 30 20:08:04 2020,1596123484,PEGI 7,101M,4.1 en hoger,2.5.8,0 USD,4.5540056
1,https://lh3.googleusercontent.com/wZS6IKu1030dj2HcIiJhg_XrIdsFfjn29SucIxyLpMaJt9_14_Qq6dRJPoDglnb61aoV,Grow Castle,https://play.google.com/store/apps/details?id=com.raongames.growcastle&hl=nl&gl=nl,com.raongames.growcastle,https://play.google.com/store/apps/developer?id=RAON+GAMES,RAON GAMES,"It is a defense game to protect the castle from enemy attack.<br>If growth can be placed in the castle tower and the hero on each floor.<br>Archer of the town is becoming a lot more more powerful the more upgrades.<br><br>More than 120 heroes can use their own skills.<br>Some heroes are made to give a strong archers of the town, another hero is cursed enemy.<br>This strategy is important because only a hero can be mounted up to nine.<br><br>When you build colonies and hire workers, you can earn more gold.<br><br>Clear up to a higher level, wave and check out your rankings.<br>Create or join a online guild. You can communicate and play with people around the world.<br><br>※ Features<br>Online guild system<br>Real-time rankings<br>Hero promotion system<br>Addictive without reason<br>Build your own castle","€ 0,99 - € 94,99 per item",GAME_ARCADE,23619103,10000000,Sun Sep  6 13:10:31 2020,1599381631,PEGI 12,41M,4.4 en hoger,1.31.14,0 USD,4.3614197
2,https://lh3.googleusercontent.com/hQ8e4C7P8YGyKPxxZ_5QxhCJJtxiwy5yxsLhh6_pgI6S4GMgQtl-WXckLst5MOuh1w,Tower defense koning,https://play.google.com/store/apps/details?id=com.mobirix.towerking&hl=nl&gl=nl,com.mobirix.towerking,https://play.google.com/store/apps/dev?id=4864673505117639552,mobirix,Nu zijn ze samen met een monster. Hagel raken van de pijl! Kleurrijke magie! Krachtige blast! De tijd van de strijd kwam terug.<br>Bouw een lijn van verdediging en een sterke toren Verdedig je koninkrijk is het lot van het koninkrijk ligt in jouw handen.<br>Speel nu de best verkochte spel van tower defense games Defensie voor gratis<br><br>[Kenmerken]<br>- De 25 kaarten geproduceerd in verschillende thema&#39;s<br>- Drie modi om de grenzen te testen<br>- Zijn de vijf soorten van het blokkeren van je baas!<br>- 12 soorten elementaire torens en verlenging van de strategische keuze van de negen soorten Special Tower<br>- Brilliant spreuk om steun te verwijderen voor de vijand!<br>- Gelieve te verdedigen vasthoudend vijandelijke aanvallen met een krachtige upgrade van de 15 stappen<br>- Controleer de wereldwijde ranking in eindeloze modus<br>- Zodra de strijd tegen monsters ondersteunt snel vooruit functie.<br>- challenge mode support<br>- Android Tablet Ondersteuning<br><br>Homepage :<br>https://play.google.com/store/apps/dev?id=4864673505117639552<br><br>Facebook : <br>https://www.facebook.com/mobirixplayen<br><br>YouTube :<br>https://www.youtube.com/user/mobirix1,"€ 2,99 - € 99,99 per item",GAME_STRATEGY,9644936,5000000,Tue Sep 29 04:51:19 2020,1601342479,PEGI 3,41M,4.1 en hoger,1.4.6,0 USD,4.272098
3,https://lh3.googleusercontent.com/xsDfBqc_rQjomJDSQd3hr-y1dwtyYRSb-HoI4WgbFntm7nRD_UISwGdvL-qZadYnKIM,Steampunk Defense: Tower Defense,https://play.google.com/store/apps/details?id=com.stereo7games.steampunk&hl=nl&gl=nl,com.stereo7games.steampunk,https://play.google.com/store/apps/developer?id=stereo7+games,stereo7 games,"Get ready for steampunk tower defense offline battles! Defend your lands against evil invaders! <br><br>Your team will consist of modern snipers, gunners, rockets, ice towers and other great things. <br><br>A deep conflict has been brewing between you and the evil invaders. Fight to protect your freedom and liberty. <br><br><br>Fight on tropical islands, in mountains, and in deserts. <br><br>Command your steampunk iron troops and find the best tower defense strategy to become number one in this awesome TD game with epic battles in jungles. <br><br>The game does not require wi-fi to be played with.<br><br><br>*** Steampunk Defense ***<br><br>Awesome tower defense with great units and characters <br><br>* Lots of soldiers, tanks, and guns. <br>* 3 islands with unique levels that allow you to fully defend and have the full battle experience <br>* Offline strategy game which does not require Internet connection or Wi-FI<br>* 100 levels in tropics, deserts and jungles <br>* Enemies from infantry to aviation <br>* Upgrade your units in the laboratory <br><br>Offline tower defense has never been so extreme and beautiful. Play offline without wi-fi in our strategy game!<br><br><br>Your feedback is greatly appreciated! <br><br>stereo7games@gmail.com","€ 0,59 - € 119,99 per item",GAME_STRATEGY,2429062,1000000,Tue Sep 15 09:07:13 2020,1600144633,PEGI 7,93M,5.1 en hoger,20.32.479,0 USD,4.2059283
4,https://lh3.googleusercontent.com/Atshv3yaPvaClV9x6SE51TA1E7m9e1KIewYnQiwws1RXc6saiGBZ_P9-D2FEVfMToWQ,Towerlands - strategy of tower defense,https://play.google.com/store/apps/details?id=mobi.blackbears.towerlands&hl=nl&gl=nl,mobi.blackbears.towerlands,https://play.google.com/store/apps/dev?id=5536898725395678245,Black Bears,"Do you like epic online tower defense strategy games?<br><br>Towerlands is an addictive game that mixes the genre of the tower defense (TD) with strategy mechanics and role-playing (RPG) elements. Choose your strategy for the tower defence!<br><br>You will feel like strategic a castle lord in a fantasy world. Your goal is defence the castle from enemies and takes over new lands. To defend your castle!<br><br>Build a city to upgrade and equip your army with the best weapons. Grow your tower to defend your castle from attacks by bandits, Orcs and the undead. Hire and train new units to raise the most powerful army in the world rating. Choose your strategy, conquer enemy castles and earn more gold.  Fight versus epic boss and take the best loot. Become a Towerlands hero of the war in and try to upgrade all heroes like warriors, wizards, archers, and so many other defenders!<br><br>Create or join a clan to play with friends. You can exchange resources with players and fight against other clans for gold and resources. Defeat everyone and build your empire as in the best empire games!<br><br><br> Features: <br><br>⭐️ 1000 waves of enemies to survive.<br>⭐️ 27 units to explore and train.<br>⭐️ 30 artifacts for the craft.<br>⭐️ Strategic map.<br>⭐️ 6 different buildings.<br>⭐️ 3 enemy races: Orcs, undead, bandits.<br>⭐️ 8 locations.<br>⭐️ Online clan system.<br>⭐️ World ranking of players and clans.<br>⭐️ You can play offline.<br>⭐️ Idle gold farming.<br><br>You can use a different strategy, for example, you can use only archers for protection or only magicians, or you can combine the best and create your own unique strategy.<br><br>Did you like to play? We will be very glad to hear from you!<br><br>If you have troubles with the game, write to:<br>- support@blackbears.mobi<br>- https://www.facebook.com/blackbearsgames","€ 0,99 - € 109,99 per item",GAME_STRATEGY,2012231,1000000,Thu Sep 24 12:06:00 2020,1600936560,PEGI 3,91M,4.4 en hoger,1.10,0 USD,4.0512524
5,https://lh3.googleusercontent.com/af0XOJLxeBcHOIKh0LcBXMZGLdRrD5Q8MITFl9Awn6tecgpT_hfu5GjDNZR7dcydP5Y,Toy Defense Fantasy — Torenverdediging,https://play.google.com/store/apps/details?id=com.melesta.toydefense3&hl=nl&gl=nl,com.melesta.toydefense3,https://play.google.com/store/apps/dev?id=5280080061020002660,Melsoft Games,"Beste vrienden, wij zijn verheugd jullie uit te nodigen voor het volledig vernieuwde Toy Defense Fantasy! Toy Defense Fantasy 2.0 trakteert fans van het torenverdedigingsgenre op uitmuntende graphics, een gebruikersvriendelijke interface en spannende gevechten!<br><br><b>Toy Defense Fantasie</b> kent nu een MAGISCHE nieuwe wereld met rappe strijders, onbevreesde boogschutters, handige kobolden en een allesomvattende magische atmosfeer!<br><br>Toernooimodus is toegevoegd! Bereid je voor op de strijd in enerverende wekelijkse toenooien. Probeer je vrienden te verslaan en pak alle topprijzen! Volg de op de kaart de vorderingen van je Facebook-vrienden - weet wat je te wachten staat!<br><br>Meer dan 15 miljoen fans uit de hele wereld spelen de Toy Defense-franchise! Wees de eerste om de derde uitgave van de Toy Defense-serie te ontdekken: <b>Toy Defense Fantasy</b>! Verklaar de oorlog aan afzichtelijke kobolden en angstaanjagende draken! De meest epische strijd ooit wacht op JOU!<br><br>Stap in de rol van een bevelhebber uit de 10e eeuw en word de gelijke van Richard Leeuwenhart! Werf en train strijders, tovenaars, boogschutters en genezers van je koninkrijk om een krachtig lezer op te bouwen en de vijandelijke troepen te verslaan! Verdedig je kasteel en toon je moed om deze gemene monsters uit je land te verdrijven!<br><br>GAME-ONDERDELEN:<br><br>▶ Duik onder in een middeleeuwse fantasiewereld<br>▶ Ongelofelijke graphics met een verbluffend gedetailleerde middeleeuwse omgeving.<br>▶ Strijd tegen boosaardige generaals aan het einde van iedere aanvalsgolf!<br>▶ Nodig je vrienden uit om met je mee te doen in een magische wereld!<br>▶ Bereid je voor op de strijd in enerverende wekelijkse toenooien met je vrienden!<br>▶ Absoluut unieke levels met ongeëvenaarde gameplay!<br>▶ Meer dan negen soorten vijanden, van trollen en kobolden tot draken en huursoldaten<br>▶ Ontwikkel je eigen unieker strategie met zes gespecialiseerde toren-powerups<br>▶ Vier handige gameplay-bonussen: meteoriet, herstel, regeneratie en bevries<br>▶ Verzamel alle trofeeën, test je staal op het strijdveld en geniet van een lange strijd!  <br><br>Voel de spanning van middeleeuwse gevechten! Perfectioneer de vaardigheden van je strijders, bouw betere verdedigingsforten en ontwerp je eigen strategie om te heersen over de vijandelijke legers! Het wordt tijd om voor eens en altijd het kwaad uit je land te verdrijven!<br><br>http://www.facebook.com/toydefense3<br>http://www.Melesta-Games.com<br>http://www.twitter.com/MelestaGames<br><br>Check ook onze andere games!","€ 0,99 - € 109,99 per item",GAME_STRATEGY,8449637,5000000,Mon Sep 28 23:00:51 2020,1601321451,PEGI 7,Varieert per apparaat,Varieert per apparaat,Varieert per apparaat,0 USD,4.4675107
6,https://lh3.googleusercontent.com/mWg88a-cmNs3vpoj4GVdmG1Uw0eqEwiwJRUK1cl1LFyguJAQnvVPSPoOQjkGWlFheJNP,Empire Warriors Premium: Tower Defense Games,https://play.google.com/store/apps/details?id=com.zitga.empire.warriors.td.tower.defense&hl=nl&gl=nl,com.zitga.empire.warriors.td.tower.defense,https://play.google.com/store/apps/dev?id=7674514660084826148,ZITGA,"If you are a fan of tower defense games free and strategy games, Empire Warriors Premium: Tower Defense Games is a must-have addictive game that can&#39;t be missed in your &#39;challenging games&#39; folder.<br>With powerful heroes, unique towers, epic challenges and also funny moments which are combined in this tower defense games free, Empire Warriors Premium will satisfy your demand.<br>What are you waiting for? Don&#39;t waste your time anymore!<br><br>Not only be able to satisfy your demand, this Premium Bundle will also satisfy your budget when you can get huge benefits with 300% less expensive than making in-app purchases!<br>★ Miria – The Strongest Hero<br>★ 1,500 gems<br>★ 300 crystals<br>★ 6 supportive 4* runes<br>★ 50 VIP coins<br>⚠ Game data in this version is different from the free version (Empire Warriors TD)<br><br><b>▶ Fantasy Story</b><br>The origin of Empire Warriors Premium is on Ioria, a fantasy continent, where Human, Elf, Dwarf, Orc and other legendary creatures live together.<br>Every places you come, every battles you join, and every castles you build, everything have a story behind.<br>Countless of champions with enough courage who have engaged this marvelous empire with tons of weapons, magic elements and mysterious aspects, have found its story.<br>Now it&#39;s your turn. Are you brave enough, champions?<br><br><b>▶ Best Tactical TD Game In A Magical Fantasy World</b><br>Will you have enough courage to take into this greatest empire with a galaxy of weapons, magic things and so on?<br>Let enjoy a lot of epic wars in different fantasy environment: the plain of human, dense forests of elves, the mountain kingdom of dwarves, the dead swamp, frozen mountain, and many more!<br><br><b>▶ Build, Battle, Defend</b><br>Perform your best strategy in this tactical TD game with 4 new specialized castles:<br>- Barrack Tower, trains strong warriors that, led by the brave knights of Endia to help you block the path and destroy the enemies.<br>- Archer Tower, deals physical damage and bring useful buffs to nearby towers.<br>- Magic Tower, control by best wizards of Endia, has high magic damage, ability to debuff the enemies and summon awesome dragon.<br>- Golem Tower, the mighty weapon of Endia kingdom, which can throw giant rock to the enemies and deal massive damage.<br><br><b>▶ Complex And Addictive Gameplay</b><br>Various modes of gameplay in this fantasy TD game, from easiest to toughest, besides the campaign missions, the player also can enjoy the infinite challenges in endless mode.<br>Not only that, offline option combines with online will bring to you the great experience. Let’s show the world who is the best tactician by ranking yourself top one on the leaderboard.<br>The endless mode is also a very good one to farm gems and to be a legend in epic battle.<br><br><b>▶ Endless Action Tactical TD Game</b><br>Control mighty legend heroes: now you can select and control 3 heroes at a time to protect the empire in any mission!<br>Each hero has an active ability and 3 passive abilities. By upgrading heroes, their strength will increase greatly. <br><br><b>▶ Formidable Challenges</b><br>A variety of monster with an infinite rush in the tower defense games free: more than 30 types of enemies are waiting for you.<br>Each monster has a unique appearance and some even have abilities that may cause a lot of trouble to every tactician.<br><br>Learn more about your kingdom with an in-game encyclopedia. Be ready for tower defense games free in the strategy games. It&#39;s worth every penny.<br>No fear of death! Be a wise leader and join now!<br><br>Contact us for further support and information:<br>- E-mail: zitgastudios@gmail.com<br>- Official Fanpage: https://www.facebook.com/EmpireWarriorsTD<br>- Official Group: https://www.facebook.com/groups/EmpireWarriorsTD<br>- Official Twitter: https://twitter.com/EmpireWarriorTD","€ 0,79 - € 79,99 per item",GAME_STRATEGY,3796383,1000000,Thu Sep 17 09:13:57 2020,1600317837,PEGI 7,106M,5.0 en hoger,2.3.8,790000 EUR,4.382607
7,https://lh3.googleusercontent.com/niyBqfAZweV8FfbszoJ8AtkSzt5h8t4DHU6bl4lSOCrmfziH5urAdtDQEQRhXd3njzI,King Of Defense: Battle Frontier (Merge TD),https://play.google.com/store/apps/details?id=com.gcenter.kingofdefense.battle.frontier.td&hl=nl&gl=nl,com.gcenter.kingofdefense.battle.frontier.td,https://play.google.com/store/apps/dev?id=6177492284961668428,GCenter,"King of Defense: Battle Frontier is a special tower defense game. The combination of turrets improves the tactics for the player. In this game, players can stack the turrets together to create the best strategy for the level. <br>        The kingdom border is alarmed by the invasion of monsters. Join the heroes and warriors of the epic battle to defend your kingdom. <br>        Like other tower defense games, King of Defense: Battle Frontier always emphasizes tactics. A game has many ways to pass depending on the strategy of each person. By the way, King of Defense: Battle Frontier is always new and not boring.<br>- NEW FEATURES:<br>        ★ The turret stacking and combining feature gives players more options for the best tactics.<br>        ★ The systems of heroes and turrets are rich and powerful upgrade. Many options upgrade according to the player&#39;s strategy.<br>        ★ Diverse terrains like deserts to jungle and frigid lands. Players need good strategies for each type of terrain.<br>        ★ Diversity of monsters from flying monsters to monsters with special skills.<br>Let&#39;s experience the new challenge and unique strategy game - King of Defense: Battle Frontier.<br>---------------------------------------<br>Contact us for further support and information:<br>- Official Fanpage: https://www.facebook.com/KingOfDefense.BattleFrontier<br>- Official Group: https://www.facebook.com/groups/KingOfDefense.BattleFrontier","€ 0,59 - € 42,99 per item",GAME_STRATEGY,886099,500000,Sat Sep 26 14:22:27 2020,1601117547,PEGI 7,102M,4.1 en hoger,1.5.36,0 USD,4.42963
8,https://lh3.googleusercontent.com/WDdFhyqbFSVjGHwqUX-tTAp14Yvm9_Byi4ey1HQL35EGa-jn-HdhwCIUoF85l2wChFY,Tower Defense: Magic Quest,https://play.google.com/store/apps/details?id=com.stereo7games.fantasydefense&hl=nl&gl=nl,com.stereo7games.fantasydefense,https://play.google.com/store/apps/developer?id=stereo7+games,stereo7 games,"One of the best offline strategy games 2020!<br><br>Take part in epic magic battles and defend all towers in awesome tower defense game which does not require wi fi. Complete all of 20 fantastic levels of this tower defense free game.<br><br>In Tower Defense: Magic Quest you will confront numerous enemies that siege your towers in fascinating locations — valleys, dwarven mines, mountains, deserts, seaboard and even floating islands.<br><br>Magic Quest: Tower Defense<br><br>A unique tower defense with outstanding units<br><br>- Epic magic battles<br>- Lots of magical creatures: goblins, orks, ogrs and many others<br>- 6 unique territories to defend allow you to have the full battle experience<br>- 40 levels<br>- 4 upgradable towers<br>- No Wi Fi Internet Required<br>- Classic tower defense mechanics<br><br>Join the epic adventure in the world of beautiful and extreme tower defence game in the best strategy offline game. Play without Internet / Wi Fi.","€ 0,50 - € 89,99 per item",GAME_STRATEGY,457308,100000,Mon Sep 28 16:14:04 2020,1601297044,PEGI 7,63M,4.1 en hoger,2.0.224,0 USD,4.2069526
