,img_src,title,link,id,developer_link,developer_name,description,price_inapp,category,num_downloads,num_downloads_approx,published,published_timestamp,pegi,filesize,os,software,price,rating
36,https://lh3.googleusercontent.com/OmRFgoSS-iZDwzkMpygYEjbBkpY-_fpE2CEiEgj2KG0yoj2DcP01fbGMutWEf8ip2tiv,Rise of Kingdoms: Lost Crusade,https://play.google.com/store/apps/details?id=com.lilithgame.roc.gp&hl=nl&gl=nl,com.lilithgame.roc.gp,https://play.google.com/store/apps/dev?id=6526849192653249949,LilithGames,"11 Civilizations, 34 Heroes, Real Warfare<br>  <br>From the depths of obscurity to the peaks of legend, you will be the author of your civilization&#39;s history. Will you launch epic wars and conquer the entire world? Or rise up as a virtuous leader renowned for your sagacity? Will you set off to explore the unknown as a pioneer? Or dedicate yourself to helping your own people?<br> <br>Only time will tell...<br> <br><b>**Features**</b><br><br><b>Real-Time Battles</b><br>Battles are not pre-calculated but happen in real time on the map. Anyone can join or leave a battle at any time, allowing true RTS gameplay. See an ally being attacked right in your backyard? Send some troops to help your buddy out, or launch a surprise counterattack on the attacker’s city. <br><br><b>Seamless World Map</b><br>All in-game action takes place on a single, enormous map inhabited by players and NPC characters. No isolated bases or separate battle screens. Never before seen on mobile “infinite zoom” feature allows you to transition freely between the world view and individual cities or barbarian outposts. Map features include natural obstructions such as rivers and mountain ranges and strategic passes that must be captured to gain entrance to neighboring regions.<br><br><b>Eleven Unique Civilizations</b><br>Choose one of 11 historical civilizations (more to come!) and guide your civilization from a lone clan into a great power. Each civilization has its own architecture, unique units, and special advantages.<br><br><b>Exploration &amp; Investigation</b><br>The world of Rise of Kingdoms is covered in thick fog. Dispatch scouts to explore this mysterious land and uncover the hidden treasure within. Investigate lost temples, barbarian fortresses, mysterious caves, and tribal villages, gather intelligence on your enemies, and prepare yourself for the ultimate clash! <br><br><b>Unrestricted Troop Movements</b><br>New orders can be issued to troops at any time, offering limitless strategic possibilities. Launch a feint at an enemy city, then circle back and meet up with your alliance army to capture a pass. Dispatch troops to collect lumber from a nearby forest and have them pick off a few barbarian clans along the way. Forces can also be split up between multiple commanders so that you can engage in multiple actions simultaneously.<br><br><b>Alliance System</b><br>Full set of alliance features allow players to help one another: alliance chat with built-in translation function, officer roles, map indicators to coordinate strategies, and more! Alliances can expand their territory to gain resources, capture mountain passes and barbarian outposts to strengthen their position, and work together to unlock group achievements.<br><br><b>Conquer the Kingdom</b><br>Fight alongside your alliance to take control of this vast kingdom. Clash with other players and use superior tactics to emerge victorious in a MMO strategy battle royale. Rise to the top and you and your civilization will be written down in your kingdom’s history!<br><br><b>RPG Commanders</b><br>Call upon dozens of historical figures who will serve as your trustworthy commanders, from Julius Caesar and Sun Tzu to Joan of Arc and Kusunoki Masashige. Level up your commanders by defeating barbarians and sending them into battles, then upgrade their abilities using an RPG style talent tree and skill system.<br> <br><b>Expedition Mode</b><br><b>Infinite Zoom</b>--never before seen on mobile!<br><b>Scouting</b><br><b>Espionage</b><br><b>Kingdom Progression</b><br><b>Civilization Specific Cities</b><br><b>Stunning Graphics</b><br><b>3D Character Models</b><br>And more…<br> <br>Facebook: https://www.facebook.com/riseofkingdomsgame/","€ 1,09 - € 239,99 per item",GAME_STRATEGY,40993051,10000000,Sun Sep 27 11:13:09 2020,1601192589,PEGI 12,104M,4.1 en hoger,1.0.38.10,0 USD,4.284537
37,https://lh3.googleusercontent.com/gCwU4dg30CBhTySkZkslhTkLpn_j_OefP_vZGRownSyPOhNnpUTKbqWuxbSeo60S7JNj,Hexonia,https://play.google.com/store/apps/details?id=com.togglegear.game.hexonia&hl=nl&gl=nl,com.togglegear.game.hexonia,https://play.google.com/store/apps/developer?id=Togglegear,Togglegear,"Choose a Tribe and build your kingdom. Conquer villages and cities to expand your land. Learn new Tech to increase Gold income and prepare your army. Warriors, knights, cannons, battleships and many more Units to choose from!<br>Come up with new strategies to defeat your opponents, and claim glorious victory!<br><br>Features<br>- Tribes each have Guardians with their own special abilities.<br>- Over 12 units to choose from, for exciting land and naval battles.<br>- The terrain generator guarantees a unique world in every game.<br>- What resources to collect and what tech to research is up to you.<br>- 4 difficulty levels awaits for your challenge!<br>- Supports English, Spanish, French, Japanese, Korean, German, Chinese.<br><br><br>You can also reach us by Email.<br>games@togglegear.com<br><br><br>For news and updates, visit the links below.<br><br>Homepage<br>https://www.togglegear.com<br><br>Facebook page<br>https://www.facebook.com/TogglegearGames<br><br>Privacy policy<br>https://www.togglegear.com/privacy-policy<br><br>Conditions and terms of use<br>https://www.togglegear.com/terms-of-service","€ 2,39 - € 3,39 per item",GAME_STRATEGY,2210109,1000000,Mon Sep 21 13:17:44 2020,1600681664,PEGI 12,82M,4.1 en hoger,1.1.30,0 USD,3.9893272
38,https://lh3.googleusercontent.com/-7eTAqz4LSCYdWidtTdoPj9rzUyNPm_KTeGP_HLhHRUZmBAaDqO2dPMsdFf51w5u_g,Verdedig de toren: kasteelverdedigingselement,https://play.google.com/store/apps/details?id=com.daedalusgames.defendthetower&hl=nl&gl=nl,com.daedalusgames.defendthetower,https://play.google.com/store/apps/dev?id=7734088243367361787,Daedalus Game,"★ Genomineerd voor de beste beelden door InfoGamer opnieuw op te starten 🏆<br><br><b> Verken levels, vernietig monsters en verzamel beloningen in dit epische torenverdedigingsspel! </b> Torenverdedigingsrijk is een gratis episch torenverdedigingsspel met belonende uitdagingen. Uw steun helpt ons bij het maken van een beter fantasiespel voor torenverdediging, gelukkig spelen: D<br><br>____________________________<br><br><b> Wat zit erin: </b><br>★ Prachtige graphics en animaties.<br>★ 150 kaarten met verschillende thema&#39;s.<br>★ 200+ verschillende collectie-items.<br>★ <b> NIEUW! </b> Neem de leiding over de legendarische Hero Viking!<br>★ Geoptimaliseerd voor Android-telefoons en -tablets!<br><br>____________________________<br><br>★ Hondvriendelijk kantoor<br>★ Topontwikkelaar<br>★ Beste apps<br><br>____________________________<br><br>Als je in het algemeen van tower defense- en offline strategiespellen houdt, dan is deze voor jou :)<br><br><b> Blijf ons steunen op: </b><br>* Web: www.daedalus-games.com<br>* Instagram: www.instagram.com/daedalus_games/<br>* Facebook: www.facebook.com/daedalusteam<br>* Twitter: www.twitter.com/gamesdaedalus","€ 3,29 - € 26,99 per item",GAME_STRATEGY,78037,50000,Sat Sep 26 00:10:51 2020,1601066451,PEGI 3,Varieert per apparaat,4.3 en hoger,3.1.5,0 USD,4.16
39,https://lh3.googleusercontent.com/jZwiDoZJo4Tq4Xho_k_9SApID1dtNDpNwGstYKmBm_66QMlr6V6I1eOqT2gg0bivqg,Deep Town: Mining Factory,https://play.google.com/store/apps/details?id=com.rockbite.deeptown&hl=nl&gl=nl,com.rockbite.deeptown,https://play.google.com/store/apps/dev?id=7565902691518792438,Rockbite Games,"⭐⭐⭐Google Play Editors&#39; Choice⭐⭐⭐<br><br>DIG DEEP and uncover the hidden story behind Deep Town and along the way discover story artifacts, dig deeper, and build mining stations to produce more resources! 🔨🔧⛏<br><br>Wondering if you&#39;ve got what it takes to be able to manage a large production, earn revenue, and collect story artifacts? Manage your buildings and idle resources and earn enough money to upgrade productions! Make an industrial revolution to manage and automate your mine production.  <br>Expand your town mining and give your productivity a boost with drones who will automate the workflow of your mines and give you boosts on other buildings! <br><br>Deep Town is an idle industrial simulation game that mixes mining, crafting, and management to earn profit and advance your town. The aim of this miner strategy simulator is to build and optimize resources collection to gain as much productivity to help you dig deeper: use special spells 💣 to defeat over 10 different elders to uncover the crust of your town then use a rocket 🚀 to travel into outer space to mine on asteroids! 🔭Progress through the game to get the chance to terraform your planet! 🌎<br><br>Become a pro manager at multitasking and prioritizing your workflow to keep a constant flow of idle revenue - craft recipes, smelt raw resources into bars, use the rain water 🌧 from your water collector to grow seeds into plants in your greenhouse🌲🌱, use miner robots to make your mine deeper to reach the planet&#39;s core.<br><br>FEATURES OF DEEP TOWN<br>● Free to play<br>● Free Daily Chest 🎁<br>● Automate your mining workflow to increase your idle income<br>● Upgrade your control panel to power up your spells to dig and destroy blocks FASTER!<br>● Dig Deeper ⛏ to uncover more areas to build mines, oil buildings and chemistry mines!<br>● Send explorer bots to hidden caves on secret expeditions to collect artifacts<br>● Profit from selling your items at the right time in the trading portal and become rich! 💸<br>● Upgrade your drone bay and increase your productivity!<br>● Mine for more than 15 different resources: coal, copper, gold, obsidian and more!<br>● No Internet connection needed for main game: gain resources online and offline! 📶<br>● Climb the leaderboard and become the highest rated guild in this idle miner simulation! 🏆<br><br>Take a chance and see what combination of spells lets you tap to dig the fastest - how fast can you destroy those blocks? <br><br>GUILD UP WITH FRIENDS<br>● Join a guild to compete with other guilds<br>● Message to chat about strategies and ask for resources.<br>● Create your own team or search for an existing guild <br>● Win rewards of chests filled with rare gems and honor badges<br>● Compete in WEEKLY EVENTS<br>● Place on Top 30 or All-Time leader board 🏆<br>● Invite your friends to join in on the FUN!<br>● Donate or request materials from your guild members<br><br>Like Deep Town on Facebook! ✔️<br>https://www.facebook.com/DeepTownGame/ <br><br>Twitter ✔️<br>https://twitter.com/DeepTownGame<br><br>Instagram ✔️<br>https://www.instagram.com/thedeeptowngame/<br><br>Reddit ✔️<br>https://www.reddit.com/r/deeptown/ <br><br>Discord ✔️<br>https://discord.gg/WMgbC27 <br><br>Any problems or suggestions?<br><br>Feel free to send a message to:<br>support@rockbitegames.com","€ 0,99 - € 104,99 per item",GAME_STRATEGY,7498088,5000000,Sat Sep 26 01:06:30 2020,1601069790,PEGI 7,72M,4.1 en hoger,4.5.4,0 USD,4.5745835
40,https://lh3.googleusercontent.com/jizHnA-B0XarxbCywLaBNfEj4g-gSemWSAxKew6FB59sXAed82sHstQ_KUZHZz8oKZ4,Ancient Planet Tower Defense Offline,https://play.google.com/store/apps/details?id=air.com.mildright.AncientEmpire&hl=nl&gl=nl,air.com.mildright.AncientEmpire,https://play.google.com/store/apps/dev?id=6345473621345043765,IP Dmitri Isaenkov,"Ancient Planet is een klassiek verdedigingsspel met torens. (tower defense)<br>De vesting van een oude beschaving wordt aangevallen door enorme aantallen van aliens.<br>Gebruik geavanceerde technologieën om de aanval te stoppen en het tij te keren!<br><br>Eigenschappen:<br>- Klassiek &#39;Tower Defense&#39; voor de nostalgische liefhebbers<br>- Bouw torens in elk vrij gebied op het veld<br>- 40 unieke levels<br>- Uiteenlopende vijanden met diverse eigenschappen<br>- Het spel biedt diverse upgrades voor torens, munitie en zelfs de basis!, zodat je uiteenlopende strategieën kan toepassen<br>- Verbeteringen kunnen gereset en opnieuw toegewezen worden zonder kosten, je krijgt alle kristallen terug<br>- De verhaallijn is gebaseerd op de herinneringen van de veteranen van de Intergalactische oorlogen<br>- Onze vormgever heeft de planeet zelf bezocht om een representatief beeld te geven in het spel<br>- Karakterstemmen klinken identiek als echte stemmen<br>- Het spel is ontwikkeld in opdracht van de Hoge raad van de intelligente beschavingen van het Heelal<br>- Er zou hier nog een advertentie moeten staan maar helaas kwam deze niet door de censuur heen, &#39;Galactische energiedrank &#39;Improviser&#39; met een extract van brandstof dat moeheid tegengaat en een paar jaar van je leven afneemt. &#39;Improviser&#39; voor een actief en snel leven!<br><br>We zijn dol op strategieën, we hebben ons best gedaan op dit spel en het heeft een mooi resultaat opgeleverd<br>Laat zeker jouw ervaringen horen in de reviews, we staan open voor constructieve feedback<br>Als dingen tegenvallen en hulp is noodzakelijk, dan kan je onze technische helpdesk benaderen","€ 0,99 - € 49,99 per item",GAME_STRATEGY,1902937,1000000,Tue Sep 29 21:22:56 2020,1601401976,PEGI 7,Varieert per apparaat,4.4 en hoger,Varieert per apparaat,0 USD,4.513691
41,https://lh3.googleusercontent.com/xYGkgiMVr1b_8rTVI24NpxaZI-zT4_0OpiWaKXSNiMdPhBIVEE9CToTzfcgX0JKw4Q,Castle Defender: Hero Idle Defense TD,https://play.google.com/store/apps/details?id=com.unimob.castle.defender.heroes&hl=nl&gl=nl,com.unimob.castle.defender.heroes,https://play.google.com/store/apps/dev?id=8685213464217636069,Unimob,"Defend your castle of royal kingdom in the best TD game - castle defense games!<br>Defense massive waves of enemies to protect your castle in CASTLE DEFENDER: Hero Idle Defense TD - tower defense, castle defense games!<br><br>Summon all strategic tower defense strategy!<br><br>Use your archery skills as you lead an idle defense heroes team, magic bow and more, in the #1 castle defender!<br><br>Castle Defender: Hero Idle Defense TD is one of great idle defender tower defense games that challenges skilled players like you!<br><br><b>▶ ARE YOU READY TO COME UP WITH THE BEST IDLE DEFENDER FOR YOUR HERO DEFENSE TO FIGHT WITH ENEMIES AND DEFENDER YOUR CASTLE TD ATTACK?</b><br><br>- Defense with the ultimate bow by TAPPING THE SCREEN.<br>- Throw freeze, tornado to the zombies which attack your hero defense kingdom speed<br>- Don’t miss using your heroes great skills during the castle td battles!<br>- UPGRADE and equip for 30+ heroes who you summoned before starting a new level of hero defense games<br>- Prepare enough hero defense energy and strategy for your castle defence hero before starting a fight in tower defense games by offline.<br><br>Just like players defender their castle td in the best epic idle defense games, you have to defend the castle of your kingdom in this castle defense games!<br><br>Play this idle defender offline game with fun idle tower defense offline TD games! Try out all modes and challenge your limits! When you win, you can have more gems, gold to upgrade your castle and your idle defender heroes to defend the castle.<br><br><b>⚔️FUNCTION:</b><br>✔️Defend your castle in 5 maps such as: Forest, Temple, Sea, Cave and Labyrinth<br>✔️250+ fun LEVELS from Normal, Hard, Hell, Expert, Master and Hell<br>✔️With the help of ultimates like: tornado, freeze...<br>✔️30+ heroes to summon and upgrade in castle defence<br>✔️Lots of different monsters running wild, each with their own special attacks of castle defender!<br>✔️Many hero defense choosing upgrade for tower defense strategy td games - warrior, witch, knight, bower...<br><br>Become an idle defense hero and rush into protecting your castle from the all enemies. Get ready for the most epic castle defense battles of all time to defense castle - td games - Castle Defender: Hero Idle Defense TD!<br><br>Connect with us:<br>- Fanpage: https://www.facebook.com/CastleDefenderTD/<br>- Twitter: twitter.com/UnimobGames<br>- Email: support@unimobgame.com","€ 0,99 - € 54,99 per item",GAME_STRATEGY,428804,100000,Thu Oct  1 09:51:39 2020,1601533299,PEGI 7,94M,4.4 en hoger,1.5.1,0 USD,4.5424356
42,https://lh3.googleusercontent.com/VvqSAfa3dl0U2-PSCb6Q6wN3eO91ZBhxMyakYBTapbyv8dr7DfQvcOa3fVTc3XyV5hMd,Battle Legion - Mass Battler,https://play.google.com/store/apps/details?id=com.traplight.battleslides&hl=nl&gl=nl,com.traplight.battleslides,https://play.google.com/store/apps/developer?id=Traplight+Ltd.,Traplight Ltd.,"Massive 100v100 Unit Battles - Build an army and watch it fight idle-style - Plenty of units and skins. Endless fun! Battle Legion puts you in shoes of an aspiring commander, and as you rank up through unforgettable victories, so does your legion.<br><br>Design and tweak your army from dozens of unique units, ranging from classic sword and shield fighters to arcane wizardry, dark age machinery, and mythical creatures. Equip your troops with Powers that match your masterplan, sit back, and watch how they fight pitted enemy legions to the bitter end.<br><br>- BITESIZED COMBAT: Battles last 20 seconds or less.<br>- LAID BACK GAMING: You plan the army layout, and they do the fighting.<br>- AUTO-PLAY: Your legion keeps fighting as you go about your daily business.<br>- COSMETICS: Choose what your units, battlefield, and banner looks like.<br>- PLAYER BATTLES: Face other players in the battlefield and learn from their strategies.<br>- POWER UP: Boost your units with dynamic seasonal Powers.<br>- REFRESHING SEASONS: New content introduced in bi-weekly Seasons, with fourth Season marking the dawn of a new Era.<br><br>Battle Legion has an active Discord community of over 10K members where players discuss winning strategies, tips and development of the game — with devs frequently participating in the chat. Weekly streams and community events hosted on Youtube!<br><br><br>-------------<br><br>Discord: https://discord.gg/udksY6y<br>Youtube: https://www.youtube.com/c/BattleLegion<br>Privacy Policy: http://traplightgames.com/privacy-notice/<br>Terms of Service: http://traplightgames.com/terms-of-service/","€ 2,99 - € 109,99 per item",GAME_SIMULATION,2193407,1000000,Thu Sep 24 12:39:34 2020,1600938574,PEGI 7,Varieert per apparaat,4.4 en hoger,1.3.1,0 USD,4.5628524
43,https://lh3.googleusercontent.com/Ew-zZsHRRG9_P2NDWpEIkyrF330gAIci0j4vxEoxgrrbsUMCqiXO4EVB6mGT7UE_NceN,celuitbreiding oorlogen,https://play.google.com/store/apps/details?id=com.mobirix.MultiplyWar&hl=nl&gl=nl,com.mobirix.MultiplyWar,https://play.google.com/store/apps/dev?id=4864673505117639552,mobirix,"Met de eenvoudigste besturing kunnen spelers verschillende strategieën gebruiken (Attack, Defence, Heal).<br>Verdedig je cellen tegen vijandelijke aanvallen en neem vervolgens een tegenaanval om de cellen van vijanden over te nemen.<br><br>[Kenmerken]<br>- Eenvoudige bediening<br>- Met lijnvermenigvuldigingscellen kunnen spelers meer tentakels spannen.<br>- Aanvallende cellen kunnen meer schade toebrengen aan vijanden.<br>- Defensieve cellen kunnen de gezondheid van bondgenotencellen terugkrijgen.<br>- Verschillende ondersteunende items die spelers helpen<br>- Verschillende en unieke minigames.<br>- 16 talen ondersteund.<br>- Prestatie en leaderboard ondersteund.<br>- Tablet PC-apparaten worden ondersteund.<br><br><br>Homepage :<br>https://play.google.com/store/apps/dev?id=4864673505117639552<br><br>Facebook : <br>https://www.facebook.com/mobirixplayen<br><br>YouTube :<br>https://www.youtube.com/user/mobirix1","€ 2,99 - € 99,99 per item",GAME_STRATEGY,5121420,5000000,Fri Sep 18 16:45:40 2020,1600431340,PEGI 3,25M,4.1 en hoger,1.0.42,0 USD,3.9812274
44,https://lh3.googleusercontent.com/00yM3eIBGj-eGNNkzhz9bR0PkYaSy3Z10Ps2oZY_neSMGh5NCtGruRUU9gY1Ru9he-n1,Toy Defence 2 — Tower Defense game,https://play.google.com/store/apps/details?id=com.melesta.toydefense2&hl=nl&gl=nl,com.melesta.toydefense2,https://play.google.com/store/apps/dev?id=5280080061020002660,Melsoft Games,"Playtime’s over, soldier! It’s time for some real fast paced tower defense action. Lucky for you, <b>Toy Defense 2</b> has you covered. We invite you to play one of the best defense games in the mobile games industry, the atmosphere of battle games has never been so tense. Let the memories about boring defence games vanish — jump into epic td combat, take command of powerful vehicles, hone your strategy skills and become the ultimate commander of your army to win any World War II battle. A new page in the industry of defense games was now being started. Inspired by the greatest events of XX century, these tower games will leave you unforgettable impressions.<br><br><br>Think you’re tough enough? Then sharpen your tactics and tackle dynamic real-time PvP battles on Arena from across the globe. Still looking for a bigger tower defense challenge? Take the next step, develop winning strategy and compete in tournaments to rise through the ranks to the top of the ratings. Embrace opportunity to play one of the best td games for today and say “Bye” to boring defense games you have met before, their days have passed. People from countless number of countries are using their armies to claim the title of the best defender, and hundreds of battle games are going on right now. Conquer all game modes, prove superiority of your strategy, and become a true master of <b>PvP games</b>. Be artful, choose an ingenious tactics to defend your tower and show your battle games rivals who is the winner! Strategy war games have never been so captivating before.<br><br><br>They may be toy soldiers, but this no place for toying around! World war is in full play and only your army can win this epic battle. Defenders of your home turf are fully prepared and await your orders, no soldier will leave his post. No matter who you are: a beginner in tower games or a sophisticated pro in strategy war games, <b>Toy Defense 2</b> will grasp your thoughts. It’s up to you build an unstoppable army, take on unforgettably awesome td battles, work out the best strategy, conquer your enemies and seize victory!<br><br><br>✫ ✫ ✫ ✫ ✫ ✫ ✫ ✫ ✫<br><br><br>Features:<br>★ Three game modes: PvE missions, tournaments and real-time PvP battles on Arena<br>★ 290 action-packed tower defense missions, absolutely free<br>★ Famous World War II campaigns like the Battle of Iwo Jima and Operation Overlord<br>★ Vehicles from Great Britain, the U.S.A., the USSR, and Germany<br>★ Tournaments with rating system<br>★ Stunning graphics<br>★ Units upgradable by adding commanders for your army improvement<br>★ Several nations’ armies available to defend your towers during a td battle<br><br><br>✫ ✫ ✫ ✫ ✫ ✫ ✫ ✫ ✫<br><br><br>You will definitely love this epic tower defense strategy game!<br><br><br>Follow us for the updates!<br>http://www.facebook.com/ToyDefense<br>http://www.Melesta-Games.com<br>http://www.twitter.com/MelestaGames","€ 0,99 - € 99,99 per item",GAME_STRATEGY,12783365,10000000,Sat Jul 18 00:46:28 2020,1595016988,PEGI 7,95M,4.4 en hoger,2.22,0 USD,4.417861
45,https://lh3.googleusercontent.com/34XcDCKKFAWdfduTPJz7bl39uwyQ7S7M8BNH9uwS4MDqFjE3JaUFOe8fjbOWeYT97AI,Island Defense: Offline Tower Defense,https://play.google.com/store/apps/details?id=com.skeeze.islanddefense.lite&hl=nl&gl=nl,com.skeeze.islanddefense.lite,https://play.google.com/store/apps/developer?id=Skizze+Games,Skizze Games,"Get ready for modern battles to defend your islands against evil invaders!<br><br>Your team is consist of modern snipers, gunners, rockets, ice towers and other great things.<br><br>Deep in the conflict between you and evil invaders. Protect your freedom and liberty.<br><br>Fight in tropical islands, mountains and deserts.<br><br>Command your modern iron troops and find the best islands strategy to be number one in the awesome game with awesome battles.<br><br>Islands Defense<br>Awesome game with great units and characters<br>* Epic islands defense battles<br>* Lot of soldiers, tanks and guns.<br>* 3 islands with unique levels allows you to feel a total defense<br>* 11 unique guns<br>* More than 20 unique enemies<br>* 100+ islands defense levels in tropics desert and towns<br>* A lot of angry enemies<br>* Enemies from infantry to aviation<br>* Upgrade your units in laboratory<br><br>Defense games have never been so extreme and beautiful.<br><br>The best total Islands Defense you&#39;ve ever seen with a huge amount of iron and battles!","€ 0,59 - € 104,99 per item",GAME_STRATEGY,222615,100000,Fri Sep  4 10:06:07 2020,1599197767,PEGI 7,91M,5.1 en hoger,20.32.482,0 USD,4.4128113
