,img_src,title,link,id,developer_link,developer_name,description,price_inapp,category,num_downloads,num_downloads_approx,published,published_timestamp,pegi,filesize,os,software,price,rating
17,https://lh3.googleusercontent.com/pK-5TELK5bvbRhLfU6HFqxiaYypPJOWd4Qxy-MDe1JCSQZ29dKsrzpWnImqE9Lqruw,Racing Fever: Moto,https://play.google.com/store/apps/details?id=mobi.gameguru.racingfevermoto&hl=nl&gl=nl,mobi.gameguru.racingfevermoto,https://play.google.com/store/apps/dev?id=4972816319461272638,Gameguru,"De makers van Racing Fever brengen een gloednieuwe motorrace-ervaring uit!<br><br>In dit spel hebben we alle adrenaline, fun en opwinding samengebracht die een bandenset jou kan brengen. De geweldige race-ervaring en adembenemende graphics zullen ervoor zorgen dat je je telefoon niet meer kunt neerleggen.<br><br>4 verschillende camerastandpunten<br>Voor een realistischere ervaring kan je spelen vanuit het gezichtspunt van je piloot, of je kan meer controle over de race krijgen door gebruik te maken van verschillende camerastandpunten.<br><br>Realistisch gemodelleerde motorfietsen<br>We hebben 16 verschillende motorfietsen tot in de kleinste details voor jou gemodelleerd. Maak je keuze, verbeter het prestatievermogen, pas het ontwerp aan en start met racen.<br><br>Een raceavontuur met 4 verschillende bendeleiders en tientallen levels<br>4 verschillende regio&#39;s en 4 meedogenloze bendeleiders! Tientallen verschillende racetypes in verschillende seizoenen en in een geweldige atmosfeer staan jou te wachten. Versla alle 4 de leiders om te bewijzen dat jij de beste racer bent!<br><br>4 verschillende controleopties<br>We weten dat er geen twee racers hetzelfde zijn! We hebben een controleoptie toegevoegd om jullie allemaal tevreden te stellen. Controleer je motor door je telefoon te kantelen of door het scherm aan te raken. Je hebt geen enkel excuus om de race niet te winnen!<br><br>Ondersteuning in 23 verschillende talen<br>Wees gerust, we begrijpen en spreken dezelfde taal als jij!<br><br>Ontsnapmodus<br>In dit spel werden snelheidslimieten ingevoerd om gebroken te worden! Vergeet niet dat wanneer je voor de politie op de vlucht bent, enkel jij en je motor nog tellen!<br><br>Dagelijkse bonusmodus<br>We zijn niet vergeten om een modus toe te voegen waarin je dagelijks kunt racen om waardevolle geschenken te winnen!<br><br>Privémodus<br>Je hebt de mogelijkheid om het tijdstip, weersomstandigheden, verkeersdichtheid, snelheid en stroom, en zelfs het aantal politieagenten in te stellen! Jij bepaalt de regels, jij wint de race!<br><br>Vergeet niet om contact met ons op te nemen voor je feedback en suggesties!","€ 0,99 - € 119,99 per item",GAME_RACING,74835597,50000000,Mon Mar 16 18:49:52 2020,1584371992,PEGI 3,110M,4.4 en hoger,v1.72.0,0 USD,4.2200413
18,https://lh3.googleusercontent.com/Fto1xcq6wMHJ8RiXHFjsgwxMEoTVj4wpLQO1ucBL0VP7we7OsvS1FHxf2viW-lGzHA,Stock Car Racing,https://play.google.com/store/apps/details?id=com.minicades.stockcars&hl=nl&gl=nl,com.minicades.stockcars,https://play.google.com/store/apps/dev?id=4616666496320324735,Minicades Mobile,"Drivers start your engines! Professional oval track racing that explodes with stock car racing action!<br><br>RACE MODES :<br>Multiplayer - Race head to head against other players in realtime.<br>Regulation  - Race and set the difficulty for higher prizes.<br>Ladder - Race 10 laps against progressively faster opponents for increasing prizes.<br>Endurance - Race the full 400 lap distance.<br>Hot Lap - Set your fastest single lap on the leaderboard!<br>Practice - Practice racing lines and setup your car for race trim.<br><br>CARS:<br>Choose 18 different cars from the golden-era, super trucks right up to the modern-era stock cars. <br><br>EXPERIENCE THE SPEED<br>Feel your car on the absolute limit of adhesion around 1 to 4 mile banked oval tracks. Earn in-game cash to buy, upgrade, repair and adjust your Stock Car. Qualify to unlock new tracks for increasing prize money. <br><br>REALTIME MULTIPLAYER RACING<br>Race your friends, win prize money and championship points to make it onto the online leaderboards.<br><br>MULTIPLE TRACKS<br>5 unique tracks night and day from a 1 mile short oval to a 4 mile super speedway.<br><br>REAL CRASH PHYSICS<br>Simulated car-damage with sparks and smoke for a more realistic racing experience.<br><br>CUSTOMISE YOUR STOCKCAR<br>Design your Stock Car with team colours, hood decals and racing numbers in the Paintshop.<br><br>UPGRADE YOUR STOCKCAR<br>Engine, tires and chassis increasing your car&#39;s overall performance.<br><br>SETUP YOUR STOCK CAR<br>Allows you to Advance tune adjust your tyre pressures and suspension setups on your car for race trim.<br><br>REAL SIMULATION<br>Visually stunning 3D graphics and realistic physics.<br><br>RUBBER-BANDING ASSIST<br>Helps gets you back into the race quicker.<br><br>EARN IN-GAME CASH<br>Based on finishing position and calculated each lap round, the higher you place the more you earn.<br><br>Drivers start your engines!","€ 0,69 - € 47,99 per item",GAME_RACING,45803305,10000000,Fri Sep 11 15:02:25 2020,1599820345,PEGI 3,60M,4.4 en hoger,3.4.15,0 USD,4.049947
19,https://lh3.googleusercontent.com/590AflDt-hW2t85Cit_ODJPJdRiMMRn2cSF0vYNfsBpjm895x1zDy0npbD7IlDCvmNvI,Traffic Rider,https://play.google.com/store/apps/details?id=com.skgames.trafficrider&hl=nl&gl=nl,com.skgames.trafficrider,https://play.google.com/store/apps/dev?id=7063637161723821824,Soner Kara,"Een nieuw meesterwerk van de makers van Traffic Racer. Dit keer kruip je achter het stuur van een motor in een game-ervaring met veel meer details, met behoud van de kenmerkende fun en eenvoud.<br><br>Traffic Rider tilt het eindeloze racegenre naar een volledig nieuw niveau door de toevoeging van een volledig carrièrespeltype, eerstepersoonsperspectief, betere graphics en realistische, opgenomen motorgeluiden. De essentie van soepel arcaderacen is er nog steeds, maar dan in het jasje van de nieuwe generatie. Race op je motor op de eindeloze snelwegen. Haal het andere verkeer in, en upgrade en koop nieuwe motoren om de missies in het carrièrespeltype te verslaan.<br><br>Het is tijd om de weg op te gaan op een motor!<br><br>KENMERKEN<br>- Eerstepersoonsperspectief<br>- 29 motoren om uit te kiezen<br>- Echte motorgeluiden, opgenomen van echte motoren<br>- Gedetailleerde omgevingen met dag- en nachtvariaties<br>- Carrièrespeltype met meer dan 70 missies<br>- Online klassementen en 30+ prestaties<br>- Ondersteuning voor 19 talen<br> <br>TIPS<br>- Hoe sneller je rijdt, hoe hoger je score<br>- Als je 100 km/u rijdt, moet je het overige verkeer strak inhalen voor bonusscores en cash<br>- Als je spookrijdt, haal je een hogere score en ontvang je extra cash<br>- Doe wheelies voor een hogere score en cash<br>- Mis de Starter-Kit met 30% korting niet!<br><br>VOLG ONS<br>* http://facebook.com/trafficridergame<br>* http://twitter.com/traffic_rider<br><br>*** Geen timers, geen brandstof ***  Alleen maar eindeloze fun!<br><br>Traffic Rider wordt regelmatig bijgewerkt met je suggesties. Schrijf een recensie met je feedback.","€ 2,29 - € 109,99 per item",GAME_RACING,311022858,100000000,Fri Jul 17 16:55:02 2020,1594988702,PEGI 3,109M,5.0 en hoger,1.70,0 USD,4.3803887
20,https://lh3.googleusercontent.com/NHFJ4Rz-Sav2vSHCY9lhkOIkh9i_obOlw4EqUG-SuQNITNwAApJEJkxWbQVoRVv59g,Drive for Speed: Simulator,https://play.google.com/store/apps/details?id=com.mastercomlimited.cardriving_t&hl=nl&gl=nl,com.mastercomlimited.cardriving_t,https://play.google.com/store/apps/dev?id=6375024885749937863,Play365,"Gentlemen, start your engines! Get your car ready and start playing Drive for Speed Simulator. Drive your car through a city full of obstacles. Complete different missions around town before time runs out and try to earn as much money as you can. Use your money to buy brand new faster cars and complete missions in less time.<br><br>Drive for Speed Simulator also has a Free Ride mode to take advantage of its sandbox city. Drive around and have fun in this amazing game for Android. Download Drive for Speed Simulator now!<br><br>In Drive for Speed Simulator, choose among 20 different cars to buy and play. Customize your cars with different items: spoilers, tires, rims, paint and motor upgrades!<br><br>What are you waiting for? Start playing Drive for Speed Simulator now!<br><br>Features:<br>- More than 20 cars to play.<br>- Freeride mode in a sandbox city.<br>- 4 types of missions.<br>- Different accessories to customize your car.","€ 0,89 - € 89,99 per item",GAME_RACING,92684991,50000000,Tue Sep 15 01:41:14 2020,1600117874,PEGI 12,116M,4.1 en hoger,1.19.4,0 USD,4.123324
21,https://lh3.googleusercontent.com/wl5IkN3PL65QYojj7wLTVyK7LyKNgxUsSix0ot7DftGz_3xNeAkF4Ve55RdlT8wfKnuZ,Hill Climb Racing 2,https://play.google.com/store/apps/details?id=com.fingersoft.hcr2&hl=nl&gl=nl,com.fingersoft.hcr2,https://play.google.com/store/apps/dev?id=7064049075652771302,Fingersoft,"From the Creators of the Original Hill Climb Racing Comes Hill Climb Racing 2! It&#39;s Bigger, It&#39;s Better And It&#39;s Much Much Funner!? Play one of the most downloaded racing games!<br><br>Hill Climb Racing 2 is a free to play racing game with both online multiplayer races and an offline adventure driving mode.<br><br>• 🏆 <b>EVENTS</b> - Compete and Win in Weekly Online Multiplayer Events!<br>• 🚗 <b>UNLOCK</b> - Unlock Cars, Bikes and Trucks and Choose the Best One for Your Driving Style!<br>• 🔧 <b>UPGRADE</b> - Top the Performance of the Cars You Compete With!<br>• 🔧 <b>TUNE</b> - Choose &amp; Upgrade 14+ Unique Tuning Parts!<br>• 🎩 <b>CUSTOMIZE</b> - Create Cool Characters and Drive Awesome Cars!<br>• 🏁 <b>RACE</b> - Drive in Hundreds of Levels!<br>• 👨‍👩‍👦‍👦 <b>TEAM UP!</b> - Form the Ultimate Multiplayer Racing Team with your Friends!<br>• 💗 <b>SOCIAL</b> - Challenge Your Friends Online and Top Their Records!<br>• 🕹 <b>ARCADE FUN</b> - Perform Stunts, Flips &amp; Wheelies or Crash trying!<br>• 🏆 <b>COMPETE</b> - Climb the Online Multiplayer Leaderboards, Win Races and Be the Best!<br><br>Kill Time Driving in one of the best racing games available!  With Awesome Bikes, Cars, Motorcycles, Trucks and other great vehicles to drive both online and offline with!<br><br>Remember that we&#39;re always reading your feedback and are hard at work creating new original content: new cars, bikes, cups, levels and features. If you find a bug or have a crash let us know so we can fix it. We really appreciate if you&#39;d report what you like or dislike and any issues you may have with the game to support@fingersoft.com, please include your device make and model.<br><br>Follow Us: 🔍<br>* Facebook: https://www.facebook.com/Fingersoft<br>* Twitter: https://twitter.com/HCR_Official_<br>* Website: https://www.fingersoft.com<br>* Instagram: https://www.instagram.com/hillclimbracing_official<br>* Discord: https://discord.com/invite/fingersoft<br><br>Terms of Use: https://fingersoft.com/eula-web/<br>Privacy Policy: https://fingersoft.com/privacy-policy/<br><br>Hill Climb Racing™️ is a registered trademark of Fingersoft Ltd. All rights reserved.","€ 0,59 - € 99,99 per item",GAME_RACING,201882804,100000000,Thu Sep 24 14:17:33 2020,1600944453,PEGI 3,135M,4.2 en hoger,1.39.0,0 USD,4.369209
22,https://lh3.googleusercontent.com/-L3opR1tkJbsdlieDoI8p2lIQF0YAULKXmqPJUPu2xf6GdlNf2IO-kGtzO-BV6y8iyQ,Drift Max Pro - Car Drifting Game with Racing Cars,https://play.google.com/store/apps/details?id=com.tiramisu.driftmax2&hl=nl&gl=nl,com.tiramisu.driftmax2,https://play.google.com/store/apps/dev?id=7173825782151163970,Tiramisu,"Favorite drifting game of more than 50,000,000 people around the world. One of the best racing game and it’s an addiction!<br><br>From the creators of the legendary drifting game Drift Max comes an epic new drifting game.<br><br>Featured globally numerous times; Drift Max Pro offers you the best drifting experience ever. <br> <br>“A Fabulous Drift Racing Game” - Steemit.com<br>“Two Thumbs Up!” - Appgrooves.com<br> <br> <br>THE ULTIMATE REAL RACING SIMULATOR<br>- Stunning and realistic drifting physics<br>- Next-Gen graphics<br>- Drive around breathtaking locations such as Tokyo - Japan, New York Brooklyn - United States, Red Square Moscow - Russia during night or day time.<br>- You can get inside of every car and drive your racing car from the cockpit.<br> <br>CAREER MODE<br>- Win gold &amp; cash, collect upgrade cards to build your dream garage<br>- Get bundle packs <br>- 10 seasons in total<br>- 100’s of challenges<br> <br>ONLINE MULTIPLAYER MODE (1v1 DUAL)<br>- Be the fastest one on the asphalt! Claim victory and become a real legend by racing against friends &amp; players from all over the world<br>- Smash the leaderboards!<br>- With two different modes, best your opponent by drifting or racing<br><br>THE CONTENDER EVENTS<br>- Unique experience with limited time events <br>- Amazing drifting races for legendary cars<br>- Huge amount of gold and cash<br> <br>BURN THE ASPHALT WITH DIFFERENT GAME MODES<br>- Daily Objectives to complete and claim stunning rewards<br>- Slalom Drifting for action lovers<br>- Cone Toppling for crash lovers<br>- Perfect Drift Racing<br>- Free Ride for recording your own best drifts and sharing with friends<br> <br> CUSTOMIZE &amp; CONFIGURE<br>- Design your dream drift car<br>- Two-tone and matte paint colors, exquisite &amp; crazy graphical decals<br>- Door and hood decals<br>- Rim model and color<br>- Window tint<br>- Caliper color<br>- Wheel (Camber) angle<br>- Suspension height<br>- Racing spoiler models<br>- Cool neon underglow options<br> <br>UPGRADE &amp; TUNE &amp; BOOSTER<br>- Build your racing car with extreme upgrades<br>- Turbocharger<br>- Tire Type<br>- Gearbox<br>- Sensors<br>- Choose different tuning modes such as “control, racing or pro”<br> <br>NOTE: Drift Max Pro is a free to play game and doesn’t require an internet connection after installation! Long live offline games!<br> <br>CRATE DROP RATES:<br>Silver Crate: %98 Modification Card / %2 Car Card<br>Gold Crate: %78 Modification Card / %22 Car Card<br> <br>WARNING: Drift Max Pro does not have a cloud save feature at this time. All game progress and in-app purchases may be lost upon deletion of the game.<br> <br>JOIN OUR RACING COMMUNITY<br>https://www.youtube.com/channel/UCZWFEsHp9hgvmeX106PTdfg<br>https://www.facebook.com/driftmaxpro/<br>https://www.instagram.com/driftmaxproofficial/<br>https://www.tiramisu.game/drift-max-pro","€ 0,99 - € 99,99 per item",GAME_RACING,46041361,10000000,Fri Sep 25 11:53:57 2020,1601022237,PEGI 3,54M,4.4 en hoger,2.4.42,0 USD,4.490153
23,https://lh3.googleusercontent.com/7GHoQF-7XHbDaQuZI03pXk5ijp48tr-weYdKuOZFhs8UKyTf-z9sVSvmg_JVRdo-9vE,Payback 2 - The Battle Sandbox,https://play.google.com/store/apps/details?id=net.apex_designs.payback2&hl=nl&gl=nl,net.apex_designs.payback2,https://play.google.com/store/apps/developer?id=Apex+Designs+Entertainment+Ltd,Apex Designs Entertainment Ltd,"Gaming App of The Day - Kotaku.com<br><br>&quot;[Payback 2] manages to create a sense of overblown fun that permeates everything from straightforward races to capture the flag-inspired heists ... an immensely entertaining experience&quot; - pocketgamer.co.uk <br><br>Featured as one of the best games of the week by The Guardian<br><br>&quot;There’s a ton of stuff to do which is what gives Payback 2 such an interesting atmosphere&quot; - Super Game Droid<br><br>Android Authority&#39;s Indie App of the Day<br><br>DESCRIPTION:<br>Payback 2 includes everything from tank battles to high speed helicopter races to huge gang battles - but you really have to try it get a feel for how much variety there is, and we&#39;re adding more all the time!<br><br>FEATURES: <br>• VARIED CAMPAIGN. Fifty campaign events featuring massive street brawls, rocket car races and much, much more! <br>• TAKE ON THE WORLD. Battle your friends or over a million other players online with the game&#39;s extensive multiplayer, leaderboard and Google Play support. <br>• HOURLY, DAILY AND WEEKLY CHALLENGES. Try to beat the rest of the world in the latest new events! <br>• ENDLESS REPLAYABILITY. Make your own events in &quot;custom mode&quot; using any combination of the game&#39;s seven cities, nine game modes, varied weaponry and dozens of vehicles.","€ 4,99 - € 79,99 per item",GAME_ARCADE,105286766,100000000,Fri Jun 26 19:48:20 2020,1593184700,PEGI 12,100M,5.0 en hoger,2.104.9,0 USD,4.3354135
24,https://lh3.googleusercontent.com/xFSKYP8BY7YOybezvoy2LQfFpEmwlPy8KRgBG8Np6VZTOKf6lbAGGErzu-LPS3JMHug,Hoog snelheid auto Rivalen ras auto het spellen,https://play.google.com/store/apps/details?id=com.fungames.highway.traffic.race&hl=nl&gl=nl,com.fungames.highway.traffic.race,https://play.google.com/store/apps/dev?id=5046803102897321007,GAMEXIS,"Hoog snelheid auto Rivalen ras auto het rijden spellen<br>Draag uw gordel, start de motor koel en klaar om nieuwe extreem ultieme gek autoverkeer race 3D-spel. Car racing is een geweldige en onderhoudende eindeloze racer auto spelletjes simulatie. Heb je enige ervaring racen door stormloop verkeer? Laten we rijvaardigheid en geheime capaciteiten uit te voeren in deze briljante simulator. Het vermijden van obstakels, verkeer, auto, vrachtwagen en te concurreren hoge snelle auto&#39;s, geld in te zamelen en te bereiken als eerste de finish, nog nooit zo leuk geweest. Verslavend car racing bieden u verbluffende graphics en realistische schitterende omgeving, waar je auto zal rijden als fysieke driver en maak geweldige innerlijk gevoel als een echte stunt bestuurder door het rijden woedend auto over de grote uitdagingen van adventure racing. Verkeer 3d auto is een geheel nieuwe extreme auto rijden simulatie voor uw nieuw avontuur. Deze unieke animatie auto racespel is de beste stunt spel, dus maak je klaar om de drang naar super leuk voelen.<br><br>Hou je van auto stad drift verkeer racespel? Zo ja; Vervolgens rijd je hogere klasse auto en vul de lastige tracks en obstakels met uw hoge snelheid. Doe sensatie mid-air buitengewone race, trucs, hindernissen en belemmeringen met de lucht auto&#39;s door het circuit tegen uitdagende racers. Voor de wilde achtervolging moet je op koers te blijven, uiteindelijke beslissing van zware motor verkeer en het vergroten van uw luxe limo auto op tijd op de uitdaging te voltooien. U zult zeker genieten van deze moderne concept van de moderne nitro stad asfalt nieuw spel en het is zeker het vervullen van uw dromen van het besturen van een sportwagen. Rij voorzichtig uw snelle asfalt, omdat de weg is gevuld met scherpe bochten, obstakels en andere snelverkeer.<br>Selecteer favoriete luxe auto en voltooi je missie binnen specifieke beperkte tijd. Uw spel rol laaien de weg en versnelt je een weg om te racen tegen andere spier monster 3D-racewagen 2017. Tijdens de rit gebruik nitrous en rijden op krankzinnige snelheid om lastige stunts uit te voeren. Vul uw snelle race rijden dromen, als u wilt voorkomen dat het raken andere tegenovergestelde verkeer. Verstandig rijden geen enkele auto&#39;s en horden niet botsen. Als u eventuele obstakels te raken of laat u zijn spoor tijdens het besturen van uw auto zal crashen, zul je niet start je missie opnieuw.<br><br>Word een echte ruiter; is het tijd voor rijden massaal hoge gedetailleerde auto&#39;s, dus draag je racewagen spullen, en draai uw veiligheidsgordel. Maak je klaar om schijnbeweging en branden van de stunt tracks en versla een aantal race-rivalen. In deze gekke extreme lucht snelheid rivalen geen noodzaak om te breken en zorgen over de politie, gewoon doen wat gevaarlijke stunts. Voltooi je niveau, krijgt drie sterren en geld om prachtige levels en krachtige sportwagens te ontgrendelen te verzamelen, kunt u ook maatwerk uw snelheid van de auto, wielen, banden, verf en handling. U kunt meerdere moeilijke modes worden geconfronteerd; elke taak is meer thriller dan de vorige taak in dit Race In een auto 3d stunt spellen simulatie.<br><br>Hoog snelheid auto Rivalen ras auto het rijden spellen Kenmerken<br>- Soepelste gameplay om de race sensatie.<br>- Fantastische muziek om je geest te trillen.<br>- Tal van luxe auto&#39;s te ontgrendelen.<br>- Ton van auto racers.<br>- Amazing 3D graphics weg.<br>- Tal van milieu.<br>- Avontuurlijke rijden onder stadsverkeer.<br>- Realistische rijervaring.","€ 0,99 - € 19,99 per item",GAME_RACING,34225339,10000000,Wed Sep 30 08:26:24 2020,1601441784,PEGI 3,60M,4.1 en hoger,10.0.2,0 USD,4.089997
25,https://lh3.googleusercontent.com/98ibZGQvwWiaY9KTf6NB97-Zuy9Pgcm5tabtv23BlbJxReyAQpI4aiT_CLFwjr-YGnC5,SUP Multiplayer Racing,https://play.google.com/store/apps/details?id=com.ohbibi.sup&hl=nl&gl=nl,com.ohbibi.sup,https://play.google.com/store/apps/dev?id=5252052215468021294,Oh BiBi,"GEAR UP en maak uw motor brullen voor de gekste gratis multiplayer race-ervaring!<br>Blank uit je rivalen, drift, springen, ontploffing weg van boosters, en bereiken de finish in een stuk!<br><br>MULTIPLAYER, REAL-TIME RACING: CRUSH je rivalen<br>o Concurreren met maximaal 3 tegenstanders uit de hele wereld in een prachtige tracks<br>o Smash anderen naast de baan en duw uw auto naar de grens! Boost, jump, en drift je een weg naar de overwinning!<br>o Veel plezier met emoji&#39;s: geef je rivalen een knipoog als je vliegt door<br>o Zet in op uw overwinning aan edelstenen te verdienen!<br><br>PAS en upgrade je collectie auto<br>o Personaliseer je auto&#39;s met een breed scala van huiden<br>o Maak je collectie compleet van Muscle Cars, Monster Trucks, Rally Cars, Hot Rods, en nog veel meer!<br>o Voorzie je auto om meer upgrades te ontgrendelen (Remmen, Turbo, Banden ...)<br>MAAK JE EIGEN RACE TRACKS<br>o Bouw je eigen aangepaste tracks met behulp van de level editor<br>o Deel ze met de wereld en krijgen upvotes om edelstenen te winnen<br>Stijgen naar de top en deel uw SUCCES<br>o Nodig je vrienden uit om je scores vergelijken<br>o Deel replays van uw meest krankzinnige races met de hele wereld!<br>o Verdien prestaties en boven het leaderboard<br>o Doe mee aan speciale uitdagingen en stunts om extra edelstenen voor upgrades verdienen<br>o Nieuwe gebeurt dagelijks toegevoegd!<br>----------------------------------------<br><br>TIPS:<br>o Gebruik slipstream je rivalen voor extra snelheid<br>o Gebruik stunts, drifts en springt naar meer nitro krijgen<br>o Bash in je tegenstanders te gooien van de weg<br>o Gebruik je nitro verstandig: voor een sprong of om je rivalen te breken!<br><br>----------------------------------------<br><br>Popelen om die grote nitro knop slam? Gratis downloaden om mee te doen de gekste bende racers op Android!<br><br>Privacybeleid: https://www.ohbibi.com/privacy-policy<br>Servicevoorwaarden: https://www.ohbibi.com/terms-services<br><br>Volg ons nieuws en updates te krijgen!<br>https://www.facebook.com/OhBiBiCommunity<br>https://twitter.com/oh_bibi","€ 0,59 - € 169,99 per item",GAME_RACING,26596593,10000000,Thu Jul 16 12:00:57 2020,1594884657,PEGI 3,Varieert per apparaat,5.0 en hoger,2.2.8,0 USD,4.216649
26,https://lh3.googleusercontent.com/ekqMTRjOBNGI6qkwTl1Vm9qrm4gZ7KsnJprad3RuZNmFGfRAor1QAvFiUXeNXEbHhRQ,Real Bike Racing,https://play.google.com/store/apps/details?id=com.wordsmobile.RealBikeRacing&hl=nl&gl=nl,com.wordsmobile.RealBikeRacing,https://play.google.com/store/apps/developer?id=Italic+Games,Italic Games,"Welcome to the definitive motorcycle racing experience! Real Bike Racing is a must have game for all motor bike riders!<br><br>Start the engine, hit the gas and experience the thrill of handling a 200 HP beast. Go bumper to bumper with elite riders to win the world championship. Now get ready for adrenaline fueled racing action and ride your way to victory in the fastest lane of all!<br><br>Game Features:<br>- Take the wheel of 10+ types of unique superbikes<br>- Fully functioning rear view mirrors<br>- Realistic 3D graphics with dynamic lighting effects<br>- VR mode (virtual reality) which supports Google Cardboard &amp; etc.","€ 1,99 - € 99,99 per item",GAME_RACING,159250799,100000000,Thu May 30 15:36:55 2019,1559214415,PEGI 3,21M,4.0 en hoger,1.0.9,0 USD,4.056466
