,img_src,title,link,id,developer_link,developer_name,description,price_inapp,category,num_downloads,num_downloads_approx,published,published_timestamp,pegi,filesize,os,software,price,rating
18,https://lh3.googleusercontent.com/APnGswTAqXSkb8AlFwd-r3-EDcyovQMPTlcNbxFNZnibn6qZ4WzXGAar-4MRFRNrVJo,Iron Marines: rts offline game,https://play.google.com/store/apps/details?id=com.ironhidegames.android.ironmarines&hl=nl&gl=nl,com.ironhidegames.android.ironmarines,https://play.google.com/store/apps/dev?id=6098018911218203911,Ironhide Game Studio,"<h1>From the creators of the award winner, Kingdom Rush saga comes the most extraordinary real time strategy offline game!</h1><br>Fight challenging real time strategy sci fi battles on amazing and unknown planets. Command brave soldiers, mighty mechas and powerful aliens against hordes of space monsters, swarms of insectoids and robot armies in a galaxy far far away in this amazing rts offline game.<br><br><b>Iron Marines will give you hours of gameplay in the best real time strategy game available for mobile!<b><br><br><h2><b>PLAN, ATTACK AND BEAT ALL THE ENEMIES ADAPTING YOUR STRATEGY IN REAL TIME</b></h2><br>Change the role of your troops even in the thick of the combat, from ranger to sniper, from flamethrowers to missile launchers.<br><br><h2><b>RECRUIT AND TRAIN THE GREATEST HEROES AND BE PREPARED FOR THE ACTION</b></h2><br>Lead them into dangerous territory against near-impossible odds and unleash their mighty powers and abilities.<br><br><h2><b>TURN THE TIDE OF BATTLE</b></h2><br>With orbital strikes, intelligent mines, support troops, turrets and a wide array of special weapons. Prepare yourself for the action! <br><br>Armies of robots, crushed starships, gigantic monsters, unknown races, brave assaults, desperate rescues, audacious sabotages, the galaxy needs your command.<br>The galaxy needs the Iron Marines<br><br>FEATURES<br><b>• 21 CAMPAIGN MISSIONS</b> across three sci fi planets. Each action-packed challenge will have you improve your strategy to save the galaxy!<br><b>• 17 SPECIAL OPERATIONS</b> that will test if you have what it takes to battle your way through space.<br><b>• 40+ UPGRADES</b> to build the ultimate RTS army! Choose between Defense Drones, Napalm Rockets, Ricocheting Blasts, Lethal Weapons and many more. Plan your actions and plan the best strategy! <br><b>• +7 UNITS</b> to bring into battle and give your hero some extra firepower!<br><b>• 8 SPECIAL WEAPONS</b> to unleash hell on your enemies and keep expanding your tactics like space itself! What’s better than a well-placed missile? An orbital strike of 50 high-explosive missiles!<br><b>• DEFEAT UNIQUE BOSSES</b> in epic battles. They are green, mean, killing machines!!! Well… some are machines and these aliens aren’t green… but they’re all massive and determined to crush you. Suit up, Marines!<br><b>• 70+ ACHIEVEMENTS</b> to complete and show everyone you’re the best RTS commander in the whole galaxy! Get them all while you explore the galaxy! <br><b>• NO WI-FI IN SPACE?</b> No worries, offline play guaranteed in this amazing strategy game! Play anywhere with this offline rts game. <br><b>• CHOOSE YOUR DIFFICULTY MODE:</b> Casual, Normal or Veteran. Don’t get cocky! Or Do! Your choice!<br><b>• IMPOSSIBLE MODE.</b> Only for the most daring, reckless, all-out-of-bubblegum marines in space. We dare you!<br><br><b>HEARD ON THE MEDIA:</b><br><i>“Iron Marines catapults things to a science-fiction setting and switches up the gameplay to a Starcraft-esque, real-time strategy experience.”</i><br>- The Verge<br><br><i>“Iron Marines is a must buy for all fans of the Kingdom Rush series and tower defense games.”</i> -  iPhoneFAQ<br><br><i>“It&#39;s fun, it&#39;s deep, and it&#39;s almost certainly going to make you exclaim with joy. Iron Marines is the mobile RTS that we&#39;ve been waiting for, and it&#39;s a little bit brilliant.”</i> - Pocket Gamer<br><br><i>“After basically creating the modern tower defense genre, Ironhide went away, had a think, then came back and essentially created the modern mobile strategy game.”</i> - AppSpy<br><br><i>“It’s a chunky, cartoony real-time strategy game, it’s set in space, and it features napalm rockets.”</i> - Droid Gamers<br><br>Get the Iron Marines latest news here: www.ironmarines.com<br><br>Terms and Conditions: www.ironhidegames.com/TermsOfService<br><br>Privacy Policy: www.ironhidegames.com/PrivacyPolicy<br><br>Video creators, podcast creators, and streamers: We would love to see your content! We support and promote channel creators so, if you want us to showcase your videos or want to know more about our games, feel free to write to us to contact@ironhidegames.com</b></b>","€ 1,09 - € 104,99 per item",GAME_STRATEGY,380768,100000,Tue Jul  7 18:42:50 2020,1594131170,PEGI 7,45M,5.0 en hoger,1.5.21,3190000 EUR,4.6647716
19,https://lh3.googleusercontent.com/plEwyu4lYQ6gjjD7CYmAsVeEMGStpj_tJG7iGNvg85j2SwHvFzgSvZRgt94u-hFEPUNf,Wild Castle TD: Grow Empire in Tower Defense,https://play.google.com/store/apps/details?id=com.wildsky.wildcastle&hl=nl&gl=nl,com.wildsky.wildcastle,https://play.google.com/store/apps/developer?id=Crunchy+Studio+LLC,Crunchy Studio LLC,An addicting casual defense game with tower defense (TD) and epic heroes (RPG). Gear up and plan your defenses!<br><br>Collect and level up over 60 heroes! Combine their unique skills to perfect your strategy.<br><br>Use Auto-battle to earn rewards while relaxing!<br><br>Play with people around the world and compete on the global leaderboard!<br><br>Facebook: https://www.facebook.com/wildcastle3d/,"€ 1,99 - € 99,99 per item",GAME_ARCADE,754130,500000,Tue Sep 29 06:55:28 2020,1601349928,PEGI 3,Varieert per apparaat,4.4 en hoger,0.0.118,0 USD,4.6879587
20,https://lh3.googleusercontent.com/7pvOYyPtYYBYp8_TrCt4yu5KMuOGcky7qyL9R49Ebv9-5M6vYg1sK4XXboX1w6NMVPYd,Mushroom Wars 2: RTS Strategy 🍄 Mushroom War Game,https://play.google.com/store/apps/details?id=com.zillionwhales.mushroomwars2&hl=nl&gl=nl,com.zillionwhales.mushroomwars2,https://play.google.com/store/apps/developer?id=Zillion+Whales,Zillion Whales,"Mushroom Wars 2 is an award-winning real-time strategy game mixed with tactics of Tower Defense and the hero skill elements of a MOBA.<br><br>🏆 Best Mobile Game, GTP Indie Cup 2017<br>🏆 Best Multiplayer Game, Casual Connect 2017<br>🏆 Best Strategy Game, White Nights<br><br><h3>Command mushroom armies in real-time!</h3><br>Upgrade your fungi base, capture battle map objectives and lead your tribe to victory one tower at a time. Plan your defenses strategically and blitz through their frontlines in more than 200 challenging missions!<br><br><h3>Multiplayer PVP and Co-Op modes</h3><br>Challenge your friends or play with them - in true and fair online PVP matches for up to 4 people win the most skillful mushroom generals. Ranked leagues will show how you stack up against real competition.<br><br><h3>The ultimate combination of RTS and TD games</h3><br>Summon legendary heroes with mighty skills that act as generals while you command the mushroom tribe minions. Power up your team with buffs and sneaky abilities to gain the upper hand in breaking the enemy defenses in real-time.<br><br><b>Welcome to the most fungal battlefield action, now download Mushroom Wars 2 and craft your strategy!</b>","€ 0,89 - € 349,99 per item",GAME_STRATEGY,2108054,1000000,Mon Sep 21 14:17:41 2020,1600685261,PEGI 3,64M,4.4 en hoger,4.0.0,0 USD,4.3435655
21,https://lh3.googleusercontent.com/v2NHMRqPFzsN0ZUQAaUoTqvWN59gVojQZK4Yca_QPSb0pc7DFadSyNYqhus4FqO8XaE,Battle of Polytopia - A Civilization Strategy Game,https://play.google.com/store/apps/details?id=air.com.midjiwan.polytopia&hl=nl&gl=nl,air.com.midjiwan.polytopia,https://play.google.com/store/apps/developer?id=Midjiwan+AB,Midjiwan AB,"The Battle of Polytopia has begun. Lead your civilization into war in this low poly turn-based strategy game. Adventure into this world of blocks: explore, gather resources, farm, mine ore... Build an empire of epic proportions, train your warriors and send them to fight with armies of other civilizations.<br><br>A new take on the classic strategy 4X game with beautiful low poly art.<br><br>Pick between different tribes to raise your civilization upon, each one with one technology unlocked from the start.<br><br>An epic turn-based empire builder of auto generated maps made of blocks where you will have to think and fight on every turn. Every game will be a new experience with unlimited replay value.<br><br>Unlike other 4X or RTS long game matches, The Battle of Polytopia has an on-the-go approach to the genre: a deep strategy layer where the last battle of the war will occur pretty fast. In Single player mode, the goal of the game is either to gain the highest possible score in 30 turns (Perfection), or to destroy all opposing forces (Domination). In multiplayer the goal is either to be the first to reach 10.000 score points (Glory) or to wage war and conquest all rival capitals (Might). Attack and exterminate every civilization on your way to work or school! Finish the war before lunch! Win by conquest or win by craft, research and develop your faction further than anyone or a mix of both.<br><br>Take your clan from a tiny village to a powerful kingdom. Grow your city population by farming, fishing and mining in order to generate income to spend on warriors, to build new structures that provide advantages or to research new technologies to achieve the domination.<br><br>Leveling up your cities as they grow will give you different options: to expand your realm borders, to increase it´s population, to generate more income, to erect walls, to build gardens or to train powerful warriors. Explore the realm, myriads of tribes await for you in this turn-based strategic kingdom.<br><br>Use a warrior to discover small villages hidden in the fog, conquer them and they will become a new town for your kingdom. But beware, the more cities added to your empire the higher the cost of technological research will be.<br><br>High tier technologies will unlock new units that can even heal your troops and conquer other civilizations. Use the best strategy to achieve the domination.<br><br>Ruins of an ancient civilization will pop up on the map and will provide you with more population for your civilization or technologies to develop further your warfare units and civil constructions. After that, the right strategy will make your civilization the best one.<br><br>Watch the other clans´ alliance status with your faction, befriend them or try to conquest all by fighting with your warriors against theirs. Place your units wisely, it´s not the same to fight on a mountain than in a valley, promote your veterans units to increase their health. Troops placed inside cities will have their defense increased. High level cities will provide you with heroes to increase your army strength.<br><br>Take your units from the land to the sea by crafting them upgradable boats that will fight in epic naval battles and can bomb cities and rivals from the sea.<br><br>If you like RTS games this strategy sandbox war game will have you struggling  fighting for every pixel of the map. Battle for your kingdom and make your tribe emblem be victorious!<br><br>The Battle of Polytopia is free to play in singleplayer against the AI although if you wish to play an online battle with other people you must have purchased at least one tribe to help us maintain server costs. Are you ready for the conquer?<br><br>Discover more about this epic strategy on-the-go war game, buy its beautiful low poly art merch or get to know us on  https://www.midjiwan.com/","€ 0,99 - € 3,79 per item",GAME_STRATEGY,8335152,5000000,Fri Jul 10 14:27:01 2020,1594375021,PEGI 7,Varieert per apparaat,Varieert per apparaat,Varieert per apparaat,0 USD,4.3776507
22,https://lh3.googleusercontent.com/jLaEWleMuM7Z56oJs_Q_GbSHniflRmyu7sAm_tCaJi-PCQO28JgM5JjuOqaD19MJLw,Empire Warriors: Tower Defense TD Strategy Games,https://play.google.com/store/apps/details?id=com.zitga.empire.warriors.td&hl=nl&gl=nl,com.zitga.empire.warriors.td,https://play.google.com/store/apps/dev?id=7674514660084826148,ZITGA,"Fight powerful enemies with your wise strategies!<br>Lead your mighty heroes and protect your kingdom frontier from the darkness!<br><br>Join millions of players around the world in an endless war to gain triumph and glory. <br>If you are a true fan of the Fantasy Tower Defense, you can&#39;t miss this td game! The wonderful graphics and impressive gameplay will surprise you. <br><br>In this game, your mission is to create your own strategy to protect your throne and eliminate invaders, bring back the peace to your realm. This not only captures the most attractive features of a TD game but also has many new elements that keep you play for hours!<br><br>GAME FEATURES<br>▶ An epic tower defence that is attractive, fun and free! We name it Battle TD (btd).<br>▶ Offline mode that you can play anywhere at anytime.<br>▶ High quality graphics than most of the other tower defense and strategy games.<br>▶ Consider all power in your hand, carefully learn about your enemy to have the most suitable strategy and tactics. Build your best defense and reach glorious victory!<br>▶ 120+ maps and levels that are both challenging and interesting in a strategy game.<br>▶ 4 types of Defence Towers with different functions and strengths, come along with 5 upgradable options. Archer, Mage, Warrior, Dragon, Golem,..all is yours.<br>▶ 11 Heroes with different powers and skills. Choose your heroes to lead the btd 6 war and rush a vengeance. Defeat or being defeated, it&#39;s up to you!<br>▶ 10+ types of unique Runes that help strengthen your heroes so that they can push away any fierceful bosses and invaders.<br>▶ 30+ types of enemies with their own evil skills. Don&#39;t underestimate the minions, or they will destroy your castle!<br>▶ The intense boss fight in this addictive strategy and tower defence games and realm defense that you can never see in any other free td games!<br>▶ 5 Power-ups - the true saviors in the hardest defense moments.<br>▶ More than 100 achievements in this games - await for the mightiest defender to conquer!<br>▶ Competitive Tournament: Let&#39;s see who is the best defender in the world championship,  the Infinite Challenge!<br><br>Heads up and rush into protecting your castle and kingdom from the evil enemies. Get ready for the most epic battles td 6 of all time. <br>We&#39;re waiting for you to claim the title of Best Defender Ever!<br><br>Contact us for further support and information about Empire Warriors TD:<br>- E-mail: EmpireWarriorsTD@zitga.com.vn<br>- Official Fanpage: https://www.facebook.com/EmpireWarriorsTD<br>- Official Group: https://www.facebook.com/groups/EmpireWarriorsTD<br>- Official Twitter: https://twitter.com/EmpireWarriorTD","€ 0,79 - € 79,99 per item",GAME_STRATEGY,5940143,5000000,Thu Sep 17 09:14:01 2020,1600317841,PEGI 7,108M,5.0 en hoger,2.3.9,0 USD,4.4058113
23,https://lh3.googleusercontent.com/2hNzc7d58P7N47mBn_eQ1MhgmCx-M6da60mtANe_XV21V8uq83ib02Fp21lHou-T_Wk,Kingdom Rush Origins - Tower Defense Game,https://play.google.com/store/apps/details?id=com.ironhidegames.android.kingdomrushorigins&hl=nl&gl=nl,com.ironhidegames.android.kingdomrushorigins,https://play.google.com/store/apps/dev?id=6098018911218203911,Ironhide Game Studio,"<b>Unleash the power of the elves with brand new towers and troops - welcome to Kingdom Rush Origins! </b><br><br>Kingdom Rush Origins is the third installment of the award-winning Kingdom Rush saga, loved by millions and earning accolades from gamers and critics around the globe. <br><br>Take a trip back to the beginning, before Vez’nan ever thought to threaten the kingdom with the gem of power, and experience even more of the lightning-fast, exceptionally captivating gameplay that made the franchise a cornerstone of essential tower defense games.<br><br>In this exciting prequel, command your elven army and defend mystical lands from sea serpents, evil sorcerers, and wave after wave of gnoll tribesman, all with the help of brand-spankin’ new towers, heroes, and spells to fend off every last baddie. <br><br>Kingdom Rush Origins packs in a treasure trove of new content and features while keeping the signature look that millions have come to love. <br><br> <b>Re-enter in the world of Kingdom Rush:</b> visit mysterious elven forests, magical faery realms and even floating ruins of an ancient metropolis in this amazing tower defense game!<br><br><b><h2>Build awesome powerful towers</h2></b><br><br> ★ <b>Unleash the power of the elves with brand new towers and troops! Elf Archers, Mystic Mages, Stone Druids and the Elven Infantry make up the backbone of your army. <br><br> ★ <b>Discover 8 new specialized tower upgrades with over 18 abilities! Vanquish your enemies with elven marksmen, runed bears, magic-wielding wizards, and even giant animated trees. Execute your strategy with the unique abilities and special power of every tower!<br><br><b><h2>Train audacious and legendary heroes!</h2></b><br><br> ★ <b>Master and upgrade 9 legendary heroes and their awesome powers and spells!<br><br>★ <b>Rain lightning, summon reinforcements, and use each hero’s unique power to obliterate scores of enemies!<br><br><b><h2>Fight hordes of enemies in epic battles!</h2></b><br><br>★ <b>Take up arms against 30 new enemy types and engage in epic boss battles! Face hordes of Gnolls, giant spiders, and the terrible Twilight army. Set up your strategy and go get them! <br>★ Plan your strategy to deal with <b>intense boss fights</b><br><br><br><b><h2>More fantastic content!</h2></b><br><br>★ <b>Immerse yourself in hours of gameplay with over 70 achievements</b>, with three difficulty modes for the newbs and veterans alike. Explore the realm and get them all! <br><br>★ <b>Play different game modes - Classic, Iron, and Heroic - and prove your mettle as a master tactician.<br><br>★ <b>Get new-and-improved equipment</b> using your hard earned gems in a revamped Gnome shop.<br><br>★ Study your enemies and your towers with an <b>in-game encyclopedia.</b><br><br>★ <b>No internet? No problem! Play it offline.</b> Play the most addicting tower defense game even offline! <br><br>-----------------------------------------------------<br><br>Praise for the Kingdom Rush series: <i>Google’s Editor’s Choice Award, IGN Editor&#39;s Choice, Slide To Play Must Have, GameInformer Gold Award, 148 Apps Editor&#39;s Choice, Jay is Games Game of the Year, Pocket Gamer Gold Award, CNET Editor’s Choice Award, Gamezebo 4.5/5, Touch Arcade 4.5/5, Venturebeat 94/100.</i><br><br>Terms and Conditions:<br>https://www.ironhidegames.com/TermsOfService<br><br>Privacy Policy:<br>https://www.ironhidegames.com/PrivacyPolicy<br><br><b>Video creators, podcast creators, and streamers:</b><br>We would love to see your content on Youtube and Twitch! We support and promote channel creators so, if you want us to showcase your videos or want to know more about our games, feel free to write to us to contact@ironhidegames.com</b></b></b></b></b></b>","€ 1,09 - € 49,99 per item",GAME_STRATEGY,1197153,1000000,Wed Jul  1 22:04:29 2020,1593624869,PEGI 7,Varieert per apparaat,Varieert per apparaat,4.2.25,3190000 EUR,4.7775292
24,https://lh3.googleusercontent.com/s1RcNSWpnSvZTc7tVh-49IbE-IkAfXVWSB1VDrO4Ta9nb5rvzRizqTzdAHQTkpps3u0,Kingdom Defense:  The War of Empires (TD Defense),https://play.google.com/store/apps/details?id=com.zonmob.HeroLegend.KingdomDefense.TowerGame&hl=nl&gl=nl,com.zonmob.HeroLegend.KingdomDefense.TowerGame,https://play.google.com/store/apps/dev?id=6472399032955398374,Bravestars Games,"Kingdom Defense: War of Empires (TD Defense Games) is the most addictive Defense Games! Get ready for an epic journey to defend your kingdom against hordes of orcs, monsters, evil wizards and other nasty fiends with a vast arsenal of towers, heroes, Knight and spells at your command!<br><br>The Vikings are known for their ambitions to invade lands, but now they are the ones who must defend themselves against invaders. The invaders, also known as the force of evil, suddenly arise. Where do they come from? No one knows. They attack people and destroy the Empires. The Empires and their alliances struggle to survive. Lives and families are meaningless to these monsters. Fields rot. Woods burn. The folks suffer. Devastation is everywhere! The Kingdoms have nothing but one choice: to defend! Are you ready to fight with your tower defense in this defense games?<br><br>Lead your troops and all heroes through an epic adventure as you defend exotic lands from evil monsters with towers, heroes, and magic to help you crush your foes to a pulp.<br><br>Kingdom Defense: War of Empires - a Bigger Tower Defense game than ever before! This TD defense game is a whole new level of furiously fast, enchantingly charming gameplay and strategy!<br><br>★★★ WONDERFUL KINGDOM<br>Kingdom Defense takes place in a fantasy realm of beauty and nature. Adventure through lush forests, gold lands, snow-covered mountains, and epic deserts as you face off against armies of slimes, goblins, skeletons, werewolves, orcs, and other fearsome creatures. Defend your Kingdom from them! Engage in an epic battle to save the world with courageous heroes and ancient magic by your side!<br><br>★★★ POWERFUL TOWER SYSTEM<br>Kingdom Defense has four basic towers: Archer Turret, Knight Barrack, Stone-Thrower and Magic Dragon. Each tower has its function and strength, which is built to help to defeat certain types of monsters easier. But it can be ineffective when it comes to other opponents. Towers can be upgraded up to the fourth level. When upgraded, they gain more firepower and range to help you win the battle!<br>On top of that, tower defense can also be enhanced using stars earned per battle. With this new surge of power, you can customize each of them with various special effects and potentials such as boosting power, reducing skill cool-down. If you find out that the same strategy cannot be carried to the next battle, you can reset the skill tree to mold it to your heart&#39;s content.<br><br>★★★ MAGIC SYSTEM<br>Collect magic items such as meteor strikes, frost gems, healing wards or Gold boxes! They will significantly help you win your battles!<br><br>★★★ LEGENDARY HEROES AND KNIGHTS<br>One special feature Kingdom Defense can offer is the hero system. We aim to create a perfect combination of a strategy game and a role-playing game! In addition to towers and magic items, you can summon heroes and command them to help you fight off enemies.<br>A variety of heroes can be chosen to take to the battle: Galahad the Indomitable Warrior, Ashi the Hawkeye, Wukong, Shaman, Golem… Each of them is special on their own. Choose wisely, and you&#39;ll be the winner!<br><br>★★★ FEATURES<br>- Impressive Graphic with European style<br>- Spectacular effects<br>- Diverse monster system<br>- 12 maps and many other game modes<br>- Unique item system<br>- Strong hero system<br>- War of Empires with magic.<br><br>Kingdom Defense: War of Empires (TD Defense Games) will not cease to bring you exciting game experience. You need not only good planning and strategy in each battle, but also the ability to manage time and resources wisely as well as skillfully control your heroes.<br><br>The epic tower defense games ⚔️ rush the enemy to defend your Kingdom right now!<br><br>Connect with us:<br>Fanpage: https://www.facebook.com/KingdomDefense.BestTDGame/<br>Group: https://www.facebook.com/groups/KingdomDefense.StrategyGame/","€ 0,89 - € 44,99 per item",GAME_STRATEGY,1798892,1000000,Tue Jan  7 04:42:30 2020,1578359550,PEGI 7,85M,4.1 en hoger,1.5.7,0 USD,4.220579
25,https://lh3.googleusercontent.com/fgsiIQaVLZdh_eCFS8x6Jg_cCLz1HrE_kzSWiZjwp269zvprjZRwYFPJ7nrR_aK8MA,Hero Factory - Idle Factory Manager Tycoon,https://play.google.com/store/apps/details?id=com.playhardlab.herofactory&hl=nl&gl=nl,com.playhardlab.herofactory,https://play.google.com/store/apps/dev?id=7410968480957919859,PlayHard.Lab,"***New feature : Boss Raid Updates!<br><br>Churn out heroes from your factories to defeat powerful bosses!<br>Earn gold to expand and diversify your hero production lines.<br>Equip stronger helmets and weapons on your heroes.<br> <br>Hero Factory is a fun and easy-to-play idle tycoon RPG where you use heroes you have mass-produced in factories to defeat monsters. Upgrade your factories with the gold you’ve earned to send even more and even stronger heroes to the battlefield.<br> <br>Download now and start making heroes!<br> <br>★ Hero Factory Features ★<br> <br>* Variety of Hero Types<br>Swordsmen, Archers, Mages, Axemen, Lancers, Gunners and many more.<br> <br>* Strategically Choose from Various Skills<br>Use powerful skills to achieve victory in battle<br> <br>* Strengthen Your Heroes<br>Go on vacations to increase your heroes’ stats<br> <br>* Tile-matching Minigame<br>Merge enchant stones to upgrade your weapons and helmets<br> <br>* Exciting Adventure<br>Rewards await you throughout your epic journey<br> <br>♠ Terms of Use and Privacy Policy ♠  <br><br>https://sites.google.com/view/playhardco/terms-of-use<br>https://sites.google.com/view/playhardco/privacy-policy","€ 0,89 - € 109,99 per item",GAME_SIMULATION,3365940,1000000,Fri Sep 25 16:14:23 2020,1601037863,PEGI 3,73M,4.1 en hoger,2.5.2,0 USD,4.383579
